sku,name,category,color,price,image_url
2611,Carlton London Women Stylish Gold Flats,Heels,Gold,,images/2611.jpg
13246,Palm Tree Kids Boy Washed Blue Jeans,Jeans,Blue,,images/13246.jpg
54581,Sushilas Women Printed Green Kurta,Kurtas,Green,,images/54581.jpg
3763,Status Quo Men's London Icon Grey T-shirt,Tshirts,Grey,,images/3763.jpg
29975,Aspen Women Black Dial Watch,Free Gifts,Black,,images/29975.jpg
26101,John Miller Men Striped White Shirt,Shirts,White,,images/26101.jpg
54521,F Sports Men White Voyager Sports Shoes,Sports Shoes,White,,images/54521.jpg
9259,Mark Taylor Men Blue Striped Shirt,Shirts,Blue,,images/9259.jpg
30064,Ed Hardy Men Grey Dial Watch,Watches,Black,,images/30064.jpg
16794,Highlander Men Stripes Navy Blue Shirt,Shirts,Navy Blue,,images/16794.jpg
51053,Enamor Women Green Bikini Brief,Briefs,Green,,images/51053.jpg
49890,Q&Q Kids Girls Blue Analog Watch,Watches,Blue,,images/49890.jpg
47136,Be For Bag Women Blue Tote Bag,Handbags,Blue,,images/47136.jpg
6211,UCB Women's Print Boat Blue Top,Tshirts,Blue,,images/6211.jpg
48942,Lucera Women Silver Ring,Ring,Silver,,images/48942.jpg
23473,Lino Perros Men Red Check Scarf,Scarves,Red,,images/23473.jpg
50181,Peperone Women Beige Handbag,Kajal and Eyeliner,Beige,,images/50181.jpg
17646,Converse Unisex Green Flip Flops,Flip Flops,Green,,images/17646.jpg
30858,Fabindia Women Striped Black Kurta,Kurtas,Black,,images/30858.jpg
1808,Quechua Aluminium Print Water Bottle,Water Bottle,Purple,,images/1808.jpg
37241,United Colors of Benetton Men Black Shoes,Casual Shoes,Black,,images/37241.jpg
5494,Mr.Men Men's Charcoal Polo T-shirt,Tshirts,Grey,,images/5494.jpg
45661,Park Avenue Men Grey Melange Square Neck Vest,Innerwear Vests,Grey Melange,,images/45661.jpg
36393,Reid & Taylor Men Blue Socks,Socks,Blue,,images/36393.jpg
4546,Nike Men's Air Max Black Shoe,Sports Shoes,Black,,images/4546.jpg
21324,Louis Philippe Men Aviator Sunglasses LP201-C1,Sunglasses,Brown,,images/21324.jpg
15111,Arrow Men Stripes Coffee Brown Trousers,Trousers,Coffee Brown,,images/15111.jpg
38209,Polaroid Women Sunglasses,Sunglasses,Silver,,images/38209.jpg
40313,Warner Bros Kids White sandals,Sandals,White,,images/40313.jpg
10463,Flying Machine Men Grey Polo Tshirts,Tshirts,Grey,,images/10463.jpg
24656,ADIDAS Originals Boys White Pack of 3 Casual Socks,Socks,White,,images/24656.jpg
25784,Arrow Men Light Brown Suspenders,Suspenders,Brown,,images/25784.jpg
56276,Biara Women Skin Bra,Bra,Skin,,images/56276.jpg
37073,Lino Perros Women Purple Handbag,Handbags,Purple,,images/37073.jpg
44581,Lee Rinse Navy Blue Slim Fit Jeans,Jeans,Navy Blue,,images/44581.jpg
53536,Amante Women Pack of 3 Assorted Briefs PFCP11,Briefs,Multi,,images/53536.jpg
21116,s.Oliver Women Faded Lilac Top,Tops,Lavender,,images/21116.jpg
15323,Nike Men Solid Grey Jacket,Jackets,Grey,,images/15323.jpg
56878,HM Women Silver Heels,Heels,Silver,,images/56878.jpg
4774,ADIDAS Women 3S Pink Track Pants,Track Pants,Pink,,images/4774.jpg
57196,Elle Women Red Tunic,Tunics,Red,,images/57196.jpg
40121,ADIDAS Unisex Pack of 3 Socks,Socks,White,,images/40121.jpg
32501,Scullers Men Black Shirt,Shirts,Black,,images/32501.jpg
56044,Colorbar Full Finish Longwear Kiss Me Lipstick 07,Lipstick,Brown,,images/56044.jpg
11783,Lee Men Printed Grey Tshirts,Tshirts,Grey,,images/11783.jpg
12106,W Women Printed White Kurtis,Kurtis,White,,images/12106.jpg
26333,DKNY Women White Dial Watch NY4934,Watches,White,,images/26333.jpg
3551,Skechers Men's Charcoal Lifestyle Shoe,Casual Shoes,Brown,,images/3551.jpg
42676,Alma Women Black Kurta,Kurtas,Black,,images/42676.jpg
2483,Puma Women Spagetti Dahlia Purple Top,Tops,Purple,,images/2483.jpg
30256,Red Tape Men Black Semi Formal Shoes,Formal Shoes,Black,,images/30256.jpg
54713,Shree Women Cream-Coloured & Pink Printed Salwar Suit with Dupatta,Kurta Sets,Cream,,images/54713.jpg
51261,Park Avenue Men Black & Brown Reversible Belt,Belts,Black,,images/51261.jpg
9857,Status Quo Men Green Polo Tshirts,Tshirts,Green,,images/9857.jpg
47304,Baggit Women Green purse,Clutches,Green,,images/47304.jpg
6023,UCB Men's Johny Collar With Two Tone Green T-shirt,Tshirts,Green,,images/6023.jpg
21572,Lino Perros Men Pack of Five Striped Socks,Socks,Multi,,images/21572.jpg
15747,Nike Men Ballista SL White Sports Shoes,Sports Shoes,White,,images/15747.jpg
32959,Angry Birds Men Purple T-shirt,Tshirts,Purple,,images/32959.jpg
52080,Myntra Men Navy Blue T-shirt,Tshirts,Navy Blue,,images/52080.jpg
59468,Lucera Silver Ring,Ring,Silver,,images/59468.jpg
45037,Maxima Attivo Men White Dial Watch,Watches,White,,images/45037.jpg
4310,Tantra Kid's Unisex Papa's Joy Green Kidswear,Tshirts,Green,,images/4310.jpg
37417,Murcia Women Jute Silver Handbag,Handbags,Silver,,images/37417.jpg
53152,Mark Taylor Men Brown Shirt,Shirts,Brown,,images/53152.jpg
14695,Basics Men Black Trousers,Trousers,Black,,images/14695.jpg
32165,Playboy Women Playmate Pink Ankle Socks,Socks,Pink,,images/32165.jpg
56420,Biara Women White Bra,Bra,White,,images/56420.jpg
10235,Carrera Men Hexagaon Dial Black Watches,Watches,Black,,images/10235.jpg
1662,Nike Men Blue Windrunner Jacket,Jackets,Navy Blue,,images/1662.jpg
40545,Titan Raga Women Gold Watch,Watches,Gold,,images/40545.jpg
48728,Lucera Women Silver Earrings,Earrings,Silver,,images/48728.jpg
30632,Nike Men Challenger Spiked Yellowish Green T-shirt,Tshirts,Yellow,,images/30632.jpg
27685,Murcia Women Purple Handbag,Handbags,Purple,,images/27685.jpg
18058,Lino Perros Women Solid Purple Wallet,Wallets,Purple,,images/18058.jpg
3135,Catwalk Women Heeded Golden Strap Black Heels,Heels,Gold,,images/3135.jpg
42212,Sepia Women Pink Tunic,Tunics,Pink,,images/42212.jpg
23225,Aneri Women Tibett Pink Kurta,Kurtas,Pink,,images/23225.jpg
17010,Rocia Women Brown Heels,Heels,Brown,,images/17010.jpg
18864,Puma Men Sports Division Black Sweatshirt,Sweatshirts,Black,,images/18864.jpg
34292,Fabindia Women Multi Coloured Chanderi Dupatta,Dupatta,Multi,,images/34292.jpg
6447,Lotto Women's Cross Color Black Pink Flip Flop,Flip Flops,Black,,images/6447.jpg
7595,Nike Women Ten Blue White Shoe,Sports Shoes,Blue,,images/7595.jpg
3909,Urban Yoga Women Yoga Red Capri,Capris,Red,,images/3909.jpg
51605,Kraus Jeans Women Black Trousers,Trousers,Black,,images/51605.jpg
13682,ADIDAS Women Duramo 3 Sports Shoes,Sports Shoes,Silver,,images/13682.jpg
54145,Rocia Women Brown Flats,Heels,Brown,,images/54145.jpg
3307,Asics Men's Gel Phoenix 3 Black Silver Shoe,Sports Shoes,Black,,images/3307.jpg
42020,ADIDAS Men Brown Mudslide Shoes,Casual Shoes,Brown,,images/42020.jpg
55097,Pond's Gold Radiance Precious Youth Serum,Face Moisturisers,Gold,,images/55097.jpg
12750,Nike Unisex Swoosh Black Backpacks,Backpacks,Black,,images/12750.jpg
47552,Portia Women Brown Heels,Heels,Brown,,images/47552.jpg
54979,Femella Women White Printed Shirt,Shirts,White,,images/54979.jpg
6675,Nike Men's Free White Grey Shoe,Sports Shoes,White,,images/6675.jpg
17222,United Colors of Benetton Men Funky Eyewear Blue Sunglasses,Sunglasses,Blue,,images/17222.jpg
51437,Myntra Women Multi Coloured Printed Top,Tops,Peach,,images/51437.jpg
35172,Wildcraft Unisex Cruiser Red Backpack,Backpacks,Red,,images/35172.jpg
46480,Timex Women Steel Watch,Watches,Steel,,images/46480.jpg
45205,CASIO ENTICER Women Black Dial Analogue Watch A660,Watches,Black,,images/45205.jpg
4122,Puma Unisex Lo Punk Black Yellow Shoe,Casual Shoes,Black,,images/4122.jpg
21740,Vans Unisex Authentic Lo Pro Brown Casual Shoes,Casual Shoes,Brown,,images/21740.jpg
15575,Chhota Bheem Kids Boys Best Friends Group TShirt,Tshirts,Yellow,,images/15575.jpg
53360,Puma Woman Pink Big Cat Wallet,Wallets,Pink,,images/53360.jpg
37625,Madagascar3 Boys White Printed T-Shirt,Tshirts,White,,images/37625.jpg
56612,Streetwear True Color Claret Tint Blusher,Highlighter and Blush,Peach,,images/56612.jpg
32357,Q&Q Men Black Dial Watch,Watches,Black,,images/32357.jpg
33285,Arrow Sport Men Striped Blue Polo T-shirt,Tshirts,Blue,,images/33285.jpg
40777,Quiksilver Men White Flip Flops,Flip Flops,White,,images/40777.jpg
10007,Nike Women As Trophy Swo White T-Shirts,Tshirts,White,,images/10007.jpg
21586,Locomotive Men Washed Grey Jeans,Jeans,Grey,,images/21586.jpg
52074,Myntra Men Yellow & Blue T-shirt,Tshirts,Yellow,,images/52074.jpg
14661,Basics Men Navy Slim Fit Checked Shirt,Shirts,Navy Blue,,images/14661.jpg
20454,Baggit Women Poppins Doko Teal Blue Belt,Belts,Teal,,images/20454.jpg
32191,ADIDAS Men Phantom Blue Sports Shoes,Sports Shoes,Blue,,images/32191.jpg
52848,Adrika Women Green Earrings,Earrings,Green,,images/52848.jpg
39579,Catwalk Women Multi Colour Flats,Heels,Multi,,images/39579.jpg
25126,Lino Perros Women Black Clutch,Clutches,Black,,images/25126.jpg
57506,Lee Cooper Men Brown Sandals,Sandals,Brown,,images/57506.jpg
33043,Mother Earth Women Printed Blue Kurta,Kurtas,Blue,,images/33043.jpg
43334,Murcia Women Maroon Handbag,Handbags,Maroon,,images/43334.jpg
27671,Murcia Women Pink Handbag,Handbags,Pink,,images/27671.jpg
54383,Baggit Women Green Wallet,Wallets,Green,,images/54383.jpg
13444,United Colors of Benetton Women Printed Yellow Tops,Tops,Yellow,,images/13444.jpg
55251,Lakme Absolute Moonlit Highlighter Face Brightener 9G,Highlighter and Blush,Skin,,images/55251.jpg
31714,Fabindia Women Anusuya Silver Earrings,Earrings,Silver,,images/31714.jpg
8529,Nike Men Nike Lunarfly+  2 Navy Blue Sports Shoes,Sports Shoes,Navy Blue,,images/8529.jpg
28639,Nike Men White T-shirt,Tshirts,White,,images/28639.jpg
50723,Doodle Girls Blue Printed Dress,Dresses,Blue,,images/50723.jpg
47794,Murcia Women Brown Handbag,Handbags,Brown,,images/47794.jpg
34266,Fabindia Women Brown Silk Dupatta,Dupatta,Brown,,images/34266.jpg
18890,Arrow Woman Tyra Purple Shirt,Shirts,Purple,,images/18890.jpg
7561,Nike Men's As Spher White T-shirt,Tshirts,White,,images/7561.jpg
19942,Nike Unisex Casual Black Duffle Bag,Duffel Bag,Black,,images/19942.jpg
46646,Rasasi Men Deserve Deo,Deodorant,Blue,,images/46646.jpg
16136,Tokyo Talkies Women Printed Blue Top,Tops,Blue,,images/16136.jpg
27443,Jockey Women Pink T-Shirt,Tshirts,Pink,,images/27443.jpg
13676,ADIDAS Men Titan Sports Shoes,Sports Shoes,Silver,,images/13676.jpg
43106,Reebok Men Reespark Deo,Deodorant,Yellow,,images/43106.jpg
2221,ADIDAS Classic Blue White Backpack,Backpacks,Blue,,images/2221.jpg
55063,Lakme Enrich Satins Lipstick 421,Lipstick,Brown,,images/55063.jpg
26591,Puma Men Aqua Cat II Power Red Flip Flops,Flip Flops,Red,,images/26591.jpg
6681,Nike Women's Izanami White Blue Shoe,Sports Shoes,White,,images/6681.jpg
34054,Palm Tree Boys Washed Blue 3/4 Length Pants,Capris,Blue,,images/34054.jpg
22131,Provogue Men Black Formal Shoes,Formal Shoes,Black,,images/22131.jpg
7753,Fila Men's Victory Black Shoe,Sports Shoes,Black,,images/7753.jpg
35186,Wildcraft Unisex Grey & Black Backpack,Backpacks,Grey,,images/35186.jpg
46474,Timex Men Black Dial Watch L506,Watches,Black,,images/46474.jpg
36703,Yves Saint Laurent Men Body Kouros Perfume,Perfume and Body Mist,Black,,images/36703.jpg
15581,Proline Men Purple Polo T-shirt,Tshirts,Purple,,images/15581.jpg
14453,Enroute Women Casual Black Flats,Heels,Black,,images/14453.jpg
53394,Alma Women Blue and Sea Green Printed Kurta,Kurtas,Blue,,images/53394.jpg
20666,Classic Polo Men Striped Grey Tshirt,Tshirts,Grey,,images/20666.jpg
5004,Gini and Jony Girl's Delma Blue Kidswear,Skirts,Blue,,images/5004.jpg
25314,Casio Youth Series Men Digital Watch AE-1100W-1BVDF(D086),Watches,Black,,images/25314.jpg
11121,Puma Women Minicats Knit Blue Cap,Caps,Blue,,images/11121.jpg
33271,Gini and Jony Girls Red Skirt,Skirts,Red,,images/33271.jpg
40783,Quiksilver Men Black Flip Flops,Flip Flops,Black,,images/40783.jpg
5838,ADIDAS Men's Graphic White T-shirt,Tshirts,White,,images/5838.jpg
57734,Lotus Herbals Fruity Fusion Lip Balm,Lip Care,Maroon,,images/57734.jpg
31142,John Miller Men Check Orange Shirt,Shirts,Orange,,images/31142.jpg
3797,Converse Men Black & Red Shoes,Casual Shoes,Black,,images/3797.jpg
29981,Aspen Women Blue Dial Watch,Free Gifts,Blue,,images/29981.jpg
19728,United Colors of Benetton Women Solid Purple Shirt,Shirts,Purple,,images/19728.jpg
55407,Revlon ColorStay Overtime Relentless Raisin Lip Gloss 270,Lip Gloss,Purple,,images/55407.jpg
27027,Jealous 21 Women Blue Shorts,Shorts,Blue,,images/27027.jpg
13212,ASICS Women Gel Spree Running Grey Sports Shoes,Sports Shoes,Grey,,images/13212.jpg
28853,Proline Men Purple T-shirt,Tshirts,Purple,,images/28853.jpg
43562,Puma Men White Pack of 3 Socks,Socks,White,,images/43562.jpg
50949,Lee Women Navy Blue Roxy Fit Jeans,Jeans,Navy Blue,,images/50949.jpg
30090,Ed Hardy Men Silver Dial Watch,Watches,Steel,,images/30090.jpg
2645,Murcia Women Big Canvas Tote Bag,Handbags,Pink,,images/2645.jpg
16760,Spice Art Women Leatherette  Black Handbags,Handbags,Black,,images/16760.jpg
49864,Q&Q Kids Unisex Purple Digital Watch,Watches,Purple,,images/49864.jpg
22555,Reebok Men Reespeed Deo,Deodorant,Black,,images/22555.jpg
46010,Fabindia Maroon Printed Saree,Sarees,Maroon,,images/46010.jpg
34430,Myntra Women Face Blue T-shirt,Tshirts,Blue,,images/34430.jpg
23487,Arrow Men Grey Scarf,Scarves,Grey,,images/23487.jpg
50175,Rocia Women Black & Brown Flats,Flats,Black,,images/50175.jpg
58318,Jockey LCESCBRA Men White Pack of 3 Socks 2004,Socks,White,,images/58318.jpg
14037,Flying Machine Men Check Blue Shirts,Shirts,Blue,,images/14037.jpg
20202,Wrangler Men Glow Grey Sweatshirt,Sweatshirts,Grey,,images/20202.jpg
5460,Nike Women's Double Team Lite Black Shoe,Sports Shoes,Black,,images/5460.jpg
44747,Globalite Men Black Sparta Shoes,Casual Shoes,Black,,images/44747.jpg
36367,Reid & Taylor Men Red Tie,Ties,Red,,images/36367.jpg
52622,Mod-acc Women Purple Handbag,Handbags,Purple,,images/52622.jpg
57350,Amante Black T-Shirt Bra BGSB01,Bra,Black,,images/57350.jpg
10497,Flying Machine Women RN HS White Tshirts,Tshirts,White,,images/10497.jpg
25770,Lino Perros Men Black Suspenders,Suspenders,Black,,images/25770.jpg
11545,W Women Printed Green Kurtas,Kurtas,Green,,images/11545.jpg
56282,Biara Black Everyday Support Bra,Bra,Black,,images/56282.jpg
37087,Lino Perros Women Brown Mobile Pouch,Mobile Pouch,Brown,,images/37087.jpg
20030,United Colors of Benetton Men Solid Blue Shirt,Shirts,Blue,,images/20030.jpg
39921,Tortoise Unisex Brown Leather Duffel Bag,Duffel Bag,Brown,,images/39921.jpg
52410,Red Rose Women Black Nightdress,Nightdress,Black,,images/52410.jpg
4780,ADIDAS Women's Balance Pink T-shirt,Tshirts,Pink,,images/4780.jpg
57162,Elle Women Teal T-shirt,Tshirts,Teal,,images/57162.jpg
58916,Hakashi Men Black Silk Tie,Ties,Black,,images/58916.jpg
33427,Baggit Women Modishx Enzyme Blue Sling Bag,Handbags,Blue,,images/33427.jpg
41007,Gini and Jony Girls Woven Navy Blue Shorts,Shorts,Navy Blue,,images/41007.jpg
25542,Wrangler Women Striper Tank Yellow Top,Tops,Yellow,,images/25542.jpg
11777,Lee Men Printed Red Tshirts,Tshirts,Red,,images/11777.jpg
7939,Puma Men's Graphic Optic Black Silver T-shirt,Tshirts,Black,,images/7939.jpg
55635,Catwalk Women Gold Heels,Heels,Gold,,images/55635.jpg
42682,Alma Women Cream & Blue Kurta,Kurtas,Cream,,images/42682.jpg
2477,Nike Men's LunarFly Blue Shoe,Sports Shoes,Blue,,images/2477.jpg
27215,Doodle Kids Boy Striped Blue Shorts,Shorts,Blue,,images/27215.jpg
7105,Wildcraft Unisex Green Backpack,Backpacks,Green,,images/7105.jpg
16552,Basics Men Grey Printed Polo T-shirt,Tshirts,Grey,,images/16552.jpg
8971,Puma Men Drift Cat III CF Black Sports Shoes,Sports Shoes,Black,,images/8971.jpg
22767,BIBA Women Solid Green Kurta,Kurtas,Green,,images/22767.jpg
50347,Aurelia Women Red Kurta,Kurtas,Red,,images/50347.jpg
34602,Hanes Men Brown Boxer Brief,Briefs,Brown,,images/34602.jpg
59665,FNF Pink & Yellow Printed Evening Wear Sari,Sarees,Yellow,,images/59665.jpg
14498,Flying Machine Men Casual Black Casual Shoes,Casual Shoes,Black,,images/14498.jpg
10804,Wrangler Men Rider Solid White Shirts,Flip Flops,White,,images/10804.jpg
4921,Gini and Jony Girl's Viona Pack of 3 Tee Kidswear,Tshirts,White,,images/4921.jpg
32368,Q&Q Men Black Dial Watch,Watches,Black,,images/32368.jpg
39780,Peter England Men Yellow Casual Shirts,Shirts,Yellow,,images/39780.jpg
40748,Roxy Women Pink Flip Flops,Flip Flops,Pink,,images/40748.jpg
38652,Nike Women Double Team Lite Black Shoes,Casual Shoes,Black,,images/38652.jpg
18255,Aneri Women Multi Coloured Kurta,Kurtas,Off White,,images/18255.jpg
27488,Jockey Women Red Bikini Briefs,Briefs,Red,,images/27488.jpg
9602,Scullers Men Scul White & Red Shirt,Shirts,Black,,images/9602.jpg
23814,Puma Men Neo Low Black Casual Shoes,Casual Shoes,Black,,images/23814.jpg
48525,French Connection Women White & Blue  Striped Dress,Dresses,White,,images/48525.jpg
3338,ADIDAS Men's Mumbai Indians White Polo T-shirt,Tshirts,White,,images/3338.jpg
35971,Flying Machine Men Tee Black T-shirt,Tshirts,Black,,images/35971.jpg
19387,ADIDAS Men Dumont Beige Sports Shoes,Sports Shoes,Beige,,images/19387.jpg
54946,Do u speak green Men Cream T-shirt,Tshirts,Cream,,images/54946.jpg
23028,Arrow Men Blue Striped Shirt,Shirts,Blue,,images/23028.jpg
42823,Little Miss Intimates Women Grey Brief,Briefs,Grey,,images/42823.jpg
51408,Myntra Men Blue and White Check Shirt,Shirts,Blue,,images/51408.jpg
55894,Colorbar Blue Lagoon Nail Lacquer 05,Nail Polish,Blue,,images/55894.jpg
7798,Proline Men White Polo T-shirt,Tshirts,White,,images/7798.jpg
9430,Lee Cooper Men Nnado Black Formal Shoes,Formal Shoes,Black,,images/9430.jpg
17813,Lee Cooper Men  Brown Casual Shoe,Casual Shoes,Brown,,images/17813.jpg
48717,Lucera Women Silver Earrings,Earrings,Silver,,images/48717.jpg
6478,ADIDAS Men Top Grey Jacket,Jackets,Grey,,images/6478.jpg
19989,United Colors of Benetton Women Printed White T-shirt,Tshirts,White,,images/19989.jpg
3936,Jealous 21 Women's Black Miss T-shirt,Tshirts,Black,,images/3936.jpg
15778,Facit Men Mid- Rise BF Grey Briefs,Briefs,Grey,,images/15778.jpg
59457,Lucera Silver Ring,Ring,Silver,,images/59457.jpg
45008,Maxima Men Digital Multifunction Watch,Watches,Steel,,images/45008.jpg
37428,Murcia Women Red Handbag,Handbags,Red,,images/37428.jpg
52883,FNF Printed Blue Sari,Sarees,Blue,,images/52883.jpg
45834,Vishudh Women Red Kurta,Kurtas,Red,,images/45834.jpg
33088,Catwalk Women Gold Flats,Heels,Gold,,images/33088.jpg
38460,Baggit Women Green Pinto Checksy Mobile Pouch,Mobile Pouch,Green,,images/38460.jpg
12139,Aurelia Women Solid Purple Kurtas,Kurtas,Purple,,images/12139.jpg
42649,Alma Women Black Kurta,Kurtas,Black,,images/42649.jpg
8186,Locomotive Men Check Lai Grey Shirts,Shirts,Grey,,images/8186.jpg
9054,ADIDAS Women Duramo 3 White Sports Shoes,Sports Shoes,White,,images/9054.jpg
30269,Speedo Men Sheet Sunglasses,Sunglasses,Brown,,images/30269.jpg
48373,French Connection Men White & Purple Check Shirt,Shirts,White,,images/48373.jpg
18403,Skechers Men Tone-Ups Black Shoe,Casual Shoes,Black,,images/18403.jpg
6820,Timberland Women's Estela Umbrella Green Flip Flop,Flip Flops,Green,,images/6820.jpg
12905,Puma Women Casual Purple Casual Shoes,Casual Shoes,Purple,,images/12905.jpg
9868,Status Quo Men Navy Blue Polo Tshirts,Tshirts,Navy Blue,,images/9868.jpg
28296,Fastrack Men Sunglasses,Sunglasses,Black,,images/28296.jpg
57995,Latin Quarters Women & White Black Dress,Dresses,Black,,images/57995.jpg
5699,Skechers Men's Striking Black Shoe,Casual Shoes,Black,,images/5699.jpg
40922,Gini and Jony Boys Rodeo Blue Jacket,Jackets,Blue,,images/40922.jpg
38838,Latin Quarters Women Pink & Black Printed Dress,Dresses,Pink,,images/38838.jpg
59033,Carlton London Women Black Heels,Heels,Black,,images/59033.jpg
21129,s.Oliver Women Printed Red Top,Tops,Red,,images/21129.jpg
56847,John Players Men Blue Jeans,Jeans,Blue,,images/56847.jpg
37870,Hidekraft Men Black Wallet,Wallets,Black,,images/37870.jpg
38004,Q&Q Women Blue Watch,Watches,Blue,,images/38004.jpg
21915,Biba Women Orange & Purple Printed Churidar Kurta with Dupatta,Kurta Sets,Orange,,images/21915.jpg
25589,Vishudh Women Green Churidar Kurta with Dupatta,Kurta Sets,Green,,images/25589.jpg
4579,Nike Women Zoo Blue Shoe,Sports Shoes,Blue,,images/4579.jpg
38236,Polaroid Unisex Sunglasses,Sunglasses,Black,,images/38236.jpg
24669,Converse Men Red Casual Shoes,Casual Shoes,Red,,images/24669.jpg
56249,SDL by Sweet Dreams Men White Pyjama Set,Night suits,White,,images/56249.jpg
15912,Black Coffee Men Stripes Blue Shirt,Shirts,Blue,,images/15912.jpg
49093,Deborah 24 Ore Lip Liner 220,Lip Liner,Mauve,,images/49093.jpg
31189,Cabarelli Men Brown Wallet,Wallets,Brown,,images/31189.jpg
18631,Puma Men GP Speed Navy Blue Tshirts,Tshirts,Navy Blue,,images/18631.jpg
9266,Scullers Men Scul Blue Shirts,Shirts,Navy Blue,,images/9266.jpg
50982,Enamor Women Maroon Robe,Robe,Maroon,,images/50982.jpg
28898,Enamor Women Red Brief,Briefs,Red,,images/28898.jpg
48141,Fossil Women Brown Wallet,Wallets,Brown,,images/48141.jpg
29176,United Colors of Benetton Boys Khaki Shorts,Shorts,Khaki,,images/29176.jpg
26902,Jealous 21 Women Printed Lavender Top,Tops,Lavender,,images/26902.jpg
35529,Enroute Teens Orange Sandals,Sandals,Orange,,images/35529.jpg
47109,Marvel Boys White Shoes,Casual Shoes,White,,images/47109.jpg
17679,Catwalk Women Buckel Pink Flats,Heels,Pink,,images/17679.jpg
30867,Fabindia Women Blue Kurta,Kurtas,Blue,,images/30867.jpg
7906,Proline Men Black & Navy Striped Polo T-shirt,Tshirts,Black,,images/7906.jpg
19525,United Colors of Benetton Men Check Grey Sweater,Sweaters,Grey,,images/19525.jpg
8172,Catwalk Women Slim Casual Beige Wedges,Heels,Blue,,images/8172.jpg
48387,French Connection Men Blue Jeans,Jeans,Blue,,images/48387.jpg
22758,BIBA Women Printed Blue Kurta,Kurtas,Blue,,images/22758.jpg
50378,Vishudh Women Red & White Salwar and Dupatta,Salwar and Dupatta,White,,images/50378.jpg
28262,18+ Men Thrill Deo,Deodorant,Blue,,images/28262.jpg
57961,Prafful Women Black & Grren Sari,Sarees,Black,,images/57961.jpg
58115,Rreverie Women Silver Pendant,Pendant,Silver,,images/58115.jpg
37884,Happy Socks Unisex Black Socks,Socks,Black,,images/37884.jpg
20833,Clarks Men Black Formal Shoes,Formal Shoes,Black,,images/20833.jpg
39122,Aneri Women Blue Leggings,Leggings,Blue,,images/39122.jpg
41038,Nautica Men Brown Dial Watch,Watches,Brown,,images/41038.jpg
58327,Lotto Women Lavender Flip Flops,Flip Flops,Lavender,,images/58327.jpg
14008,Nike Men Printed White Tshirts,Tshirts,White,,images/14008.jpg
44778,Lotto Men Grey Skateboard Shoes,Casual Shoes,Grey,,images/44778.jpg
36358,Reid & Taylor Men Red Tie,Ties,Red,,images/36358.jpg
14834,United Colors of Benetton Men Solid Black Belts,Belts,Black,,images/14834.jpg
39310,Red Chief Men Khaki Casual Shoes,Casual Shoes,Khaki,,images/39310.jpg
49067,Lino Perros Women Olive Handbag,Handbags,Olive,,images/49067.jpg
8340,Doodle Boy's Volleyball Champion Black White Kidswear,Tshirts,Black,,images/8340.jpg
46813,Gini and Jony Girls Pink Skirt,Skirts,Pink,,images/46813.jpg
19717,United Colors of Benetton Men Check Blue Shirt,Shirts,Blue,,images/19717.jpg
55438,Revlon Mauve Colorburst Lipstick 005,Lipstick,Pink,,images/55438.jpg
27018,Jealous 21 Women Washed Blue Jeans,Jeans,Blue,,images/27018.jpg
50976,Enamor Petal Pink Bra,Bra,Pink,,images/50976.jpg
29182,United Colors of Benetton Women White Tunics,Tunics,White,,images/29182.jpg
31941,Nike Women Air Rift Grey Shoes,Casual Shoes,Grey,,images/31941.jpg
7308,UCB Women's Sleeveless Light Blue Top,Tops,Blue,,images/7308.jpg
30893,Fabindia Women Printed White & Blue Patiala,Patiala,White,,images/30893.jpg
28050,Jockey ELANCE Men Charcoal Pack of 2 Briefs 1009,Briefs,Charcoal,,images/28050.jpg
48989,Lucera Women Silver Ring,Ring,Silver,,images/48989.jpg
11922,Franco Leone Men Formal Black Formal Shoes,Formal Shoes,Black,,images/11922.jpg
59691,Avirate Purple Bra,Bra,Purple,,images/59691.jpg
58743,Puma Men Olive T-shirt,Tshirts,Olive,,images/58743.jpg
5807,ADIDAS Women's Tunic Blue T-shirt,Tshirts,Blue,,images/5807.jpg
13649,ADIDAS Black Hydroterra Shandal Casual Shoes,Casual Shoes,Black,,images/13649.jpg
34857,Vans Men Classic Slip-On Black Shoes,Casual Shoes,Black,,images/34857.jpg
22932,Fastrack Unisex Black Dial Watch 9912PP13,Watches,Black,,images/22932.jpg
8724,Indigo Nation Men Checks Red Shirts,Shirts,Red,,images/8724.jpg
35985,Flying Machine Women Poppy Red T-shirt,Tshirts,Red,,images/35985.jpg
47599,Portia Women Black Flats,Flats,Brown,,images/47599.jpg
28434,DKNY Women White Dial Watch NY8299,Watches,White,,images/28434.jpg
55860,Colorbar Pro Dazzling Mauve Nail Lacquer 008,Nail Polish,Lavender,,images/55860.jpg
19141,Lotto Men Revorb Black Sandals,Sandals,Black,,images/19141.jpg
49631,Mineral Cream Dress,Dresses,Cream,,images/49631.jpg
8516,Nike Unisex Ultimatum Max Black Backpacks,Backpacks,Black,,images/8516.jpg
28606,Nike Men Air Twilight Black Shoes,Sports Shoes,Black,,images/28606.jpg
34259,Proline Men Grey Tracksuit,Tracksuits,Grey,,images/34259.jpg
46679,Rasasi Women Pack of 3 Perfumes,Perfume and Body Mist,Peach,,images/46679.jpg
16109,M tv Men My Fab Eyewear Brown Sunglasses,Sunglasses,Brown,,images/16109.jpg
25925,Femella Women Purple T-Shirt,Tshirts,Purple,,images/25925.jpg
5209,Superman Men's Job Round Neck White T-shirt,Tshirts,White,,images/5209.jpg
33840,Puma Men Hypermoto Ducati Black Shoes,Casual Shoes,Black,,images/33840.jpg
58571,Puma Men Black Shorts,Shorts,Black,,images/58571.jpg
52877,FNF Multi Coloured Sari,Sarees,White,,images/52877.jpg
39546,Numero Uno Men Yellow Flip Flops,Flip Flops,Yellow,,images/39546.jpg
25119,Lino Perros Women Gems Black Clutch,Clutches,Black,,images/25119.jpg
44912,Puma Men Black Track Pants,Track Pants,Black,,images/44912.jpg
57539,Flying Machine Men Olive Belt,Belts,Olive,,images/57539.jpg
38494,Gini and Jony Boys United Green T-shirt,Tshirts,Green,,images/38494.jpg
20037,United Colors Of Benetton Women Black Tights,Stockings,Black,,images/20037.jpg
44572,Coolers Men Black Sports Sandals,Sports Sandals,Black,,images/44572.jpg
37080,Lino Perros Women Blue Handbag,Handbags,Blue,,images/37080.jpg
57959,Prafful Turquoise Blue Printed Sari,Sarees,Turquoise Blue,,images/57959.jpg
