sku,name,category,color,price,image_url
15970,Turtle Check Men Navy Blue Shirt,Shirts,Navy Blue,,images/15970.jpg
39386,Peter England Men Party Blue Jeans,Jeans,Blue,,images/39386.jpg
59263,Titan Women Silver Watch,Watches,Silver,,images/59263.jpg
21379,Manchester United Men Solid Black Track Pants,Track Pants,Black,,images/21379.jpg
53759,Puma Men Grey T-shirt,Tshirts,Grey,,images/53759.jpg
1855,Inkfruit Mens Chain Reaction T-shirt,Tshirts,Grey,,images/1855.jpg
30805,Fabindia Men Striped Green Shirt,Shirts,Green,,images/30805.jpg
26960,Jealous 21 Women Purple Shirt,Shirts,Purple,,images/26960.jpg
29114,Puma Men Pack of 3 Socks,Socks,Navy Blue,,images/29114.jpg
30039,Skagen Men Black Watch,Watches,Black,,images/30039.jpg
9204,Puma Men Future Cat Remix SF Black Casual Shoes,Casual Shoes,Black,,images/9204.jpg
48123,Fossil Women Black Huarache Weave Belt,Belts,Black,,images/48123.jpg
18653,Fila Men Cush Flex Black Slippers,Flip Flops,Black,,images/18653.jpg
47957,Murcia Women Blue Handbag,Handbags,Blue,,images/47957.jpg
46885,Ben 10 Boys Navy Blue Slippers,Flip Flops,Navy Blue,,images/46885.jpg
12369,Reid & Taylor Men Check Purple Shirts,Shirts,Purple,,images/12369.jpg
29928,Police Men Black Dial Watch PL12889JVSB,Watches,Black,,images/29928.jpg
42419,Gini and Jony Girls Knit White Top,Tops,White,,images/42419.jpg
51832,Bwitch Beige Full-Coverage Bra BW335,Bra,Beige,,images/51832.jpg
47359,Baggit Women Brown Handbag,Handbags,Brown,,images/47359.jpg
17429,CASIO G-Shock Men Black Digital Watch G-7710-1DR G223,Watches,Black,,images/17429.jpg
12967,ADIDAS Men Spry M Black Sandals,Sandals,Black,,images/12967.jpg
6842,Timberland Unisex Rubber Sole Brush Shoe Accessories,Shoe Accessories,Black,,images/6842.jpg
13089,ADIDAS Men Lfc Auth Hood Grey Sweatshirts,Sweatshirts,Grey,,images/13089.jpg
18461,David Beckham Signature Men Deos,Deodorant,White,,images/18461.jpg
9036,Buckaroo Men Flores Black Formal Shoes,Formal Shoes,Black,,images/9036.jpg
48311,Pitaraa Women Bronze Beaded Bracelet,Bracelet,Bronze,,images/48311.jpg
7990,Fila Men's Round Neck Navy Blue T-shirt,Tshirts,Navy Blue,,images/7990.jpg
56019,Colorbar Soft Touch Show Stopper Copper Lipstick 037,Lipstick,Brown,,images/56019.jpg
21977,Murcia Women Casual Brown Handbag,Handbags,Brown,,images/21977.jpg
37812,John Players Men Navy Blue Shirt,Shirts,Navy Blue,,images/37812.jpg
4729,Disney Kids Boy's Crew Sea Life Sialing Green Teen Kidswear,Tshirts,Green,,images/4729.jpg
56825,John Players Men Brown Shirt,Shirts,Brown,,images/56825.jpg
39988,Gas Men Europa White Shoes,Casual Shoes,White,,images/39988.jpg
59051,Carlton London Women Black & Gold Toned Flats,Flats,Black,,images/59051.jpg
20099,Diva Women Embroided Green Kurta,Kurtas,Green,,images/20099.jpg
58183,Rocky S Women White Handbag,Handbags,White,,images/58183.jpg
29742,Kiara Women Teal Handbag,Handbags,Teal,,images/29742.jpg
51658,Fossil Women Copper Chronograph Watch CH2589,Watches,Copper,,images/51658.jpg
3954,Jealous 21 Women's Pink T-shirt,Tshirts,Pink,,images/3954.jpg
18839,Peter England Men Formal Black Belt,Belts,Black,,images/18839.jpg
2886,Catwalk Women Leather Brown Flats,Flats,Brown,,images/2886.jpg
23278,Maxima Ssteele Men Off White Watch,Watches,Off White,,images/23278.jpg
28690,W Women Printed Beige Kurta,Kurtas,Beige,,images/28690.jpg
8580,Scullers Men  Grey Waistcoat,Waistcoat,Grey,,images/8580.jpg
3168,Nike Men's Incinerate MSL White Blue Shoe,Sports Shoes,White,,images/3168.jpg
18005,Puma Men Long Logo Black Bermuda,Shorts,Black,,images/18005.jpg
17871,Levis Men Boxer Maroon Brief,Briefs,Maroon,,images/17871.jpg
9452,John Miller Men Stripes White Red Shirts,Shirts,Red,,images/9452.jpg
38402,Baggit Women Hood Dabang Black Belt,Belts,Black,,images/38402.jpg
44984,Maxima Women White Dial Watch,Watches,White,,images/44984.jpg
10268,Clarks Men Hang Work Leather Black Formal Shoes,Formal Shoes,Black,,images/10268.jpg
45856,Vishudh Women Brown Kurta,Kurtas,Brown,,images/45856.jpg
32138,Playboy Men Blue Titanium Briefs,Briefs,Blue,,images/32138.jpg
59435,Arrow Men Black Formal Shoes,Formal Shoes,Black,,images/59435.jpg
5891,Puma Men's Stripe Polo Black T-shirt,Tshirts,Black,,images/5891.jpg
38630,Nike Women Purple Polo T-shirt,Tshirts,Purple,,images/38630.jpg
4943,Gini and Jony Boy's Kaleb White Brown Kidswear,Shirts,White,,images/4943.jpg
11188,Carrera Men Dial steel finish strap Silver Watches,Watches,Silver,,images/11188.jpg
10866,Wrangler Men Motor Rider Red T-Shirts,Tshirts,Red,,images/10866.jpg
59607,FNF Pink & Grey Wedding Collection Sari,Sarees,Grey,,images/59607.jpg
15528,Puma Men Scribble Black Tshirts,Tshirts,Black,,images/15528.jpg
45258,CASIO EDIFICE Men Black Dial Chronograph Watch ED60,Watches,Black,,images/45258.jpg
42841,French Connection Women Beige Handbag,Handbags,Beige,,images/42841.jpg
22198,Timberland Men Black Casual Shoes,Casual Shoes,Black,,images/22198.jpg
29570,Vans Men Classic Slip-On Purple & Black Shoes,Casual Shoes,Purple,,images/29570.jpg
43993,Police Women Passion Perfume,Perfume and Body Mist,Pink,,images/43993.jpg
6628,ADIDAS Men's Lowell White Silver Shoe,Sports Shoes,White,,images/6628.jpg
54924,Do U Speak Green Men Blue Shorts,Shorts,Blue,,images/54924.jpg
26538,ID Men Red Shoes,Casual Shoes,Red,,images/26538.jpg
35913,Peperone Women Black & White Handbag,Handbags,Black,,images/35913.jpg
49495,Vans Men Khaki Shoes,Casual Shoes,Khaki,,images/49495.jpg
9660,Indigo Nation Men Reversible Bling Pink Shirts,Shirts,Pink,,images/9660.jpg
2288,Nike Women Black T-shirt,Tshirts,Black,,images/2288.jpg
23876,ADIDAS Men Blue Sweatshirt,Sweatshirts,Blue,,images/23876.jpg
18237,Manchester United Men Solid Red Tshirt,Tshirts,Red,,images/18237.jpg
54118,Rocia Women Black Flats,Heels,Black,,images/54118.jpg
2872,Catwalk Women Leather Flats,Heels,Brown,,images/2872.jpg
49653,Mineral Women Green Top,Tops,Green,,images/49653.jpg
8574,Crocs Dora Boots Pink Sandals,Sandals,Pink,,images/8574.jpg
16957,Image Men Sunglasses,Sunglasses,Black,,images/16957.jpg
19123,Lotto Men XL Water Man Silver Slippers,Flip Flops,Silver,,images/19123.jpg
13419,United Colors of Benetton Men Solid Pink Polo T-shirts,Tshirts,Pink,,images/13419.jpg
17885,Levis Men Comfort Style Grey Innerwear Vest,Innerwear Vests,Grey,,images/17885.jpg
43369,Reebok Men Black Possession Flip Flops,Flip Flops,Black,,images/43369.jpg
48781,Lucera Women Silver Pendant,Pendant,Silver,,images/48781.jpg
44970,Maxima Men White Dial Analog Chronograph Watch,Watches,White,,images/44970.jpg
56489,Streetwear Ash Nail Polish # 31,Nail Polish,Bronze,,images/56489.jpg
39524,Peter England Unisex Orange Sleeve Bag,Laptop Bag,Orange,,images/39524.jpg
33822,Puma Men Axis White & Grey Sports Shoes,Sports Shoes,White,,images/33822.jpg
58513,Tonga Women Maroon Top,Tops,Off White,,images/58513.jpg
25947,Femella Women Brown Scarf,Scarves,Brown,,images/25947.jpg
52029,Just Natural Unisex Charcoal Rain Jacket,Rain Jacket,Coffee Brown,,images/52029.jpg
5865,ADIDAS Men's Twelve Faster T-shirt,Tshirts,Black,,images/5865.jpg
39716,Arrow Woman Women Blue Dress,Dresses,Blue,,images/39716.jpg
25349,Levis Men Red Brief,Briefs,Red,,images/25349.jpg
11940,Ganuchi Men Casual Black Sandals,Sandals,Black,,images/11940.jpg
55802,SDL by Sweet Dreams Women Green Printed Night Suit S11-3124,Night suits,White,,images/55802.jpg
29584,Indigo Nation Men Printed Black T-shirt,Tshirts,Black,,images/29584.jpg
43967,DKNY Women Red Delicious Perfume,Perfume and Body Mist,Red,,images/43967.jpg
28456,Urban Yoga Women Blue Skirt With Leggings,Skirts,Blue,,images/28456.jpg
34009,Gini and Jony Girls Black Top,Tops,Black,,images/34009.jpg
19311,Nike Men Air Rift MTR White Casual Shoe,Casual Shoes,White,,images/19311.jpg
42089,ADIDAS Men White Corona Sports Shoes,Sports Shoes,White,,images/42089.jpg
22950,Fastrack Unisex Black Dial Watch 9915PP13,Watches,Black,,images/22950.jpg
49461,Vans Men Blue Era Scilla Plaid Shoes,Casual Shoes,Blue,,images/49461.jpg
8746,Crocs Kids Navy Blue Clogs,Flip Flops,Navy Blue,,images/8746.jpg
9694,Classic Polo Men Vulcan White Polo Tshirts,Tshirts,White,,images/9694.jpg
23882,Fila Men Destiny Grey Sports Shoes,Sports Shoes,Grey,,images/23882.jpg
34835,ADIDAS Men Blue Chill Sports Shoes,Sports Shoes,Blue,,images/34835.jpg
15984,Turtle Check Men Yellow Shirt,Shirts,Yellow,,images/15984.jpg
41268,Arrow Men Black Wallet,Wallets,Black,,images/41268.jpg
11518,Catwalk Women Gun Metal Grey Heels,Heels,Grey,,images/11518.jpg
14856,United Colors of Benetton Women Solid Beige Wallets,Wallets,Beige,,images/14856.jpg
33648,Lotto Men Ridge Brown Sandals,Sandals,Brown,,images/33648.jpg
59297,U.S. Polo Assn. Men White & Navy Blue Shirt,Shirts,White,,images/59297.jpg
28032,Jockey ELANCE Men Bikini White Brief 1005,Briefs,White,,images/28032.jpg
27846,Scullers For Her Charcoal Blazer,Blazers,Charcoal,,images/27846.jpg
26994,Jealous 21 Women Black Jeans,Jeans,Black,,images/26994.jpg
49839,iPanema Women Red Flip Flops,Flip Flops,Red,,images/49839.jpg
31923,Fabindia Women Blue Silk Sling Bag,Handbags,Blue,,images/31923.jpg
2618,Carlton London Women Silver Wedge Sandal,Flats,Silver,,images/2618.jpg
54588,Sushilas Women Printed Green Kurta,Kurtas,Green,,images/54588.jpg
49005,Lucera Women Silver Ring,Ring,Silver,,images/49005.jpg
8322,Doodle Boy's Route 66 Biker Blue Teen Kidswear,Tshirts,Blue,,images/8322.jpg
13841,ADIDAS Unisex Three Small Dials White Watches,Watches,White,,images/13841.jpg
28200,Ray-Ban Men Active Lifestyle Copper Sunglasses,Sunglasses,Copper,,images/28200.jpg
12993,ADIDAS Kids Adispeed Black Sports Shoes,Sports Shoes,Black,,images/12993.jpg
7158,Scullers Men  Green Check Shirt,Shirts,Green,,images/7158.jpg
18495,Puma Men Fashion Cat White Slipper,Sandals,White,,images/18495.jpg
8110,Fastrack Men Economy 2 Analg Black Watch,Watches,Black,,images/8110.jpg
19547,United Colors of Benetton Men Solid Blue Sweatshirt,Sweatshirts,Blue,,images/19547.jpg
7964,Puma Men's Large Logo Graphic Black T-shirt,Tshirts,Black,,images/7964.jpg
36934,Giorgio Armani Women Idole Perfume,Perfume and Body Mist,Gold,,images/36934.jpg
39140,Aneri Women Black & Maroon Salwar Suit,Kurta Sets,Black,,images/39140.jpg
20851,Spice Art Women Ribbon Embroidery Red Clutch,Clutches,Red,,images/20851.jpg
41866,Estd. 1977 Men Beige & Green Sandals,Sandals,Beige,,images/41866.jpg
58177,Rocky S Women Brown Handbag,Handbags,Brown,,images/58177.jpg
44528,Coolers Men Black Sandals,Sandals,Black,,images/44528.jpg
16392,Levis Men Check Red Shirts,Shirts,Red,,images/16392.jpg
51455,Tonga Women Pink Printed Shrug,Shrug,Pink,,images/51455.jpg
50587,Chromozome Men Grey Briefs,Briefs,Grey,,images/50587.jpg
17240,U.S. Polo Assn. Men Stripes Black  Polo Tshirt,Tshirts,Black,,images/17240.jpg
47530,Portia Women Copper-Toned & Brown Sandals,Flats,Copper,,images/47530.jpg
6617,Spykar Men Black and white Check Shirt,Shirts,Black,,images/6617.jpg
12732,Nike Unisex Swoosh Black Backpack,Backpacks,Black,,images/12732.jpg
3365,Myntra Men's Brain Black T-shirt,Tshirts,Black,,images/3365.jpg
42042,Nike Men Air Relentless 2 MSL White Sports Shoes,Sports Shoes,White,,images/42042.jpg
23849,ADIDAS Men Black Anzo Breeze Casual Shoes,Casual Shoes,Black,,images/23849.jpg
43190,Fastrack Women White Dial Watch,Watches,White,,images/43190.jpg
48578,Revv Men Steel Bracelet,Bracelet,Steel,,images/48578.jpg
30462,Lovable Women All Day Long Black Bra,Bra,Black,,images/30462.jpg
18208,Manchester United Men Solid White Cap,Caps,White,,images/18208.jpg
54127,Rocia Women Black Heels,Heels,Black,,images/54127.jpg
10065,Puma Men ducati logo tee Yellow Tshirts,Tshirts,Yellow,,images/10065.jpg
24250,Numero Uno Men White Casual Shoes,Casual Shoes,White,,images/24250.jpg
32335,Q&Q Men Silver-Toned Dial Analogue Watch Q252J404Y,Watches,Silver,,images/32335.jpg
25382,Levis Men White Innerwear Vest,Innerwear Vests,White,,images/25382.jpg
56670,Maxima Men Black Dial Watch,Watches,Black,,images/56670.jpg
5092,Wrangler Men's Minstrel Shoulder Loop Purple T-shirt,Tshirts,Purple,,images/5092.jpg
10859,Wrangler Men Furious Rides Navy Blue T-Shirts,Tshirts,Navy Blue,,images/10859.jpg
59638,FNF Green Wedding Collection Sari,Sarees,Green,,images/59638.jpg
15517,Rockport Men LLandro Red Casual Shoes,Casual Shoes,Red,,images/15517.jpg
4140,Skechers Women Green Shoe,Casual Shoes,Green,,images/4140.jpg
36795,Maxima Men Ssteele Silver Dial Watch,Watches,Silver,,images/36795.jpg
40527,Titan Men Gold Dial Watch,Watches,Gold,,images/40527.jpg
10257,John Miller Men Solid Type Black Trousers,Trousers,Black,,images/10257.jpg
24062,Locomotive Men Navy Blue Printed T-shirt,Tshirts,Navy Blue,,images/24062.jpg
45869,Maxima Men Brown Dial Watch,Watches,Brown,,images/45869.jpg
11385,United Colors Of Benetton Women Light Winter Black Sweatshirts,Sweatshirts,Black,,images/11385.jpg
53130,Catwalk Women Brown Sandals,Flats,Brown,,images/53130.jpg
44187,Nike Fragrances Women 5th Element Perfume 150 ml,Perfume and Body Mist,White,,images/44187.jpg
21510,Kiara Women Graphiti White Handbag,Handbags,White,,images/21510.jpg
51667,Louis Philippe Men Grey Sunglasses,Sunglasses,Grey,,images/51667.jpg
22395,Mark Taylor Men Striped Blue Shirt,Shirts,Blue,,images/22395.jpg
35322,Fabindia Women Anusuya Silver Earrings,Earrings,Silver,,images/35322.jpg
6425,Lotto Unisex Canvas Black Check Shoe,Casual Shoes,Black,,images/6425.jpg
18806,Peter England Men Casual Tan Belt,Belts,Tan,,images/18806.jpg
23247,Arrow Men Formal Black Shoe,Formal Shoes,Black,,images/23247.jpg
17072,Lino Perros Women Weaved  Grey Belt,Belts,Grey,,images/17072.jpg
31782,Lee Women Paula Blue Top,Tops,Blue,,images/31782.jpg
42270,Vans Unisex Black & Grey Classic Shoes,Casual Shoes,Black,,images/42270.jpg
12500,United Colors of Benetton Men Short Black Shirts,Shirts,Black,,images/12500.jpg
26735,Reebok Men Pack of 2 Pirates of the Caribbean Deos,Deodorant,Black,,images/26735.jpg
30650,Nike Men Printed Black T-shirt,Tshirts,Black,,images/30650.jpg
56026,Colorbar Soft Touch Mousse Lipstick 025,Lipstick,Brown,,images/56026.jpg
21948,Murcia Women Casual Brown Handbag,Handbags,Brown,,images/21948.jpg
32563,ONLY Women directoire blue Trousers,Trousers,Blue,,images/32563.jpg
58980,Colour me Women Flowers Deo,Deodorant,Pink,,images/58980.jpg
40143,Gini and Jony Girls Pretty Blossom Blue Top,Tops,Blue,,images/40143.jpg
10633,Carlton London Men Formal Brown Formal Shoes,Formal Shoes,Brown,,images/10633.jpg
24406,Vishudh Women Red Printed Kurta,Kurtas,Red,,images/24406.jpg
4716,ADIDAS Unisex Response ST Analogue Black Watch,Watches,Black,,images/4716.jpg
21174,s.Oliver Women Stripes Beige Top,Tops,Beige,,images/21174.jpg
15341,Nike Women Solid Pink Shorts,Shorts,Pink,,images/15341.jpg
52486,Red Rose Maroon Camisole,Camisoles,Maroon,,images/52486.jpg
53554,Probase Multicoloured Printed Boxers,Boxers,Multi,,images/53554.jpg
14293,Classic Polo Men Stripes Blue Tshirts,Tshirts,Blue,,images/14293.jpg
47366,Baggit Women Blue Bag,Handbags,Blue,,images/47366.jpg
6041,UCB Men's Polo Neck With Lion Logo Navy Blue T-shirt,Tshirts,Navy Blue,,images/6041.jpg
23623,Doodle Kids Girls Pink I love Shopping Top,Tops,Pink,,images/23623.jpg
17416,Lotto Men Atlantica Black Sports Shoe,Sports Shoes,Black,,images/17416.jpg
9835,Little Miss Women Printed Grey T-shirt,Tshirts,Grey,,images/9835.jpg
29319,ADIDAS Unisex Chicago Bulls Red Backpack,Backpacks,Red,,images/29319.jpg
7193,Jealous 21 Women Black Jegging,Jeans,Black,,images/7193.jpg
12958,ADIDAS Men Sports Black Sports Shoes,Sports Shoes,Black,,images/12958.jpg
27283,Mother Earth Women Magenta Kurta,Kurtas,Magenta,,images/27283.jpg
30234,Numero Uno Men Black Flip Flops,Flip Flops,Black,,images/30234.jpg
9009,Murcia Women Snake Print Bag Brown Handbags,Handbags,Brown,,images/9009.jpg
3533,Myntra Men's If You Don't Like Navy Blue T-shirt,Tshirts,Navy Blue,,images/3533.jpg
42614,Estelle Women Earrings & Pendant Set,Jewellery Set,Gold,,images/42614.jpg
12164,Aurelia Women Voile Orange Dupatta,Dupatta,Orange,,images/12164.jpg
26351,DKNY Women White Dial Watch NY8472,Watches,White,,images/26351.jpg
17624,ADIDAS Men Solid Navy Blue Track Pant,Track Pants,Navy Blue,,images/17624.jpg
47154,Gini and Jony Girls Black Capris,Capris,Black,,images/47154.jpg
35574,Gliders Men Esquire Red Flip Flops,Flip Flops,Red,,images/35574.jpg
46086,ADIDAS Women Lavender Hagkok Sports Shoes,Sports Shoes,Lavender,,images/46086.jpg
51031,Enamor White Bra,Bra,White,,images/51031.jpg
13284,Gini and Jony Kids Boys Solid Black Shorts,Shorts,Black,,images/13284.jpg
54543,F Sports Men White Outlander Sports Shoes,Sports Shoes,White,,images/54543.jpg
55491,Revlon Gold Dust Poussiere Doree Colorburst Lip Gloss 024,Lip Gloss,Brown,,images/55491.jpg
26163,John Miller Men Dark Grey Trousers,Trousers,Grey,,images/26163.jpg
3701,Tantra Women Flower Heart Black Long T-shirt,Tshirts,Black,,images/3701.jpg
29917,Police Men White Dial Watch PL12698JS,Watches,White,,images/29917.jpg
42426,Aurelia Women Sea Green Kurta,Kurtas,Sea Green,,images/42426.jpg
32751,FILA Men Liga II Black Shoes,Casual Shoes,Black,,images/32751.jpg
56214,Estelle Women Gold Earrings,Earrings,Gold,,images/56214.jpg
10401,Jealous 21 Women Uaine Purple Tops,Tops,Purple,,images/10401.jpg
40371,Tokyo Talkies Women Navy Slim Fit Jeans,Jeans,Navy Blue,,images/40371.jpg
21346,Pal Zileri Men Casual Gold Frame Sunglasses,Sunglasses,Gold,,images/21346.jpg
45603,Arrow Men Black Formal Shoes,Formal Shoes,Black,,images/45603.jpg
4524,Puma Men's YugoRun Black White Shoe,Sports Shoes,Black,,images/4524.jpg
37223,United Colors of Benetton Women Blue Top,Tops,Blue,,images/37223.jpg
53766,Puma Men White and Navy Blue T-shirt,Tshirts,White,,images/53766.jpg
25520,Doodle Kids Girls City Chic White Top,Tops,White,,images/25520.jpg
32597,ONLY Women Black Top,Tops,Black,,images/32597.jpg
58974,Colour me Men Gold Deo,Deodorant,Gold,,images/58974.jpg
33445,Baggit Women Lamboo Mayur Black Wallet,Wallets,Black,,images/33445.jpg
57100,Elle Women Dark Pink Top,Tops,Pink,,images/57100.jpg
36137,Nike Women Free Run Pink Sports Shoes,Sports Shoes,Pink,,images/36137.jpg
41859,Estd. 1977 Men Black Sandals,Sandals,Black,,images/41859.jpg
21180,ADIDAS Men Adi Cells Black Flip Flops,Flip Flops,Black,,images/21180.jpg
39943,GAS Men Brown Count Casual Shoes,Casual Shoes,Brown,,images/39943.jpg
52472,Red Rose Women White & Pink Polka Dot Print Bath Robe,Bath Robe,Pink,,images/52472.jpg
58148,Puma Unisex White Cap,Caps,White,,images/58148.jpg
20052,United Colors Of Benetton Women Yellow Muffler,Mufflers,Yellow,,images/20052.jpg
5630,ADIDAS Women's Adi Groove Blue Flip Flop,Flip Flops,Blue,,images/5630.jpg
44517,Coolers Men Brown Pokar Flip Flops,Flip Flops,Brown,,images/44517.jpg
47392,Baggit Women Beige Bag,Handbags,Beige,,images/47392.jpg
50325,Aurelia Women Navy Blue Kurta,Kurtas,Navy Blue,,images/50325.jpg
8913,Puma Men Cabana Racer Sketch White Sports Shoes,Sports Shoes,White,,images/8913.jpg
16530,Locomotive Men Check Red Shirt,Shirts,Red,,images/16530.jpg
22705,Nike Men White Capri II Casual Shoe,Casual Shoes,White,,images/22705.jpg
7167,Scullers Men Scul Purple White Shirt,Shirts,Purple,,images/7167.jpg
46240,Fusion Beats Women White Printed Tunic,Tunics,White,,images/46240.jpg
27277,Mother Earth Women Blue Kurta,Kurtas,Green,,images/27277.jpg
13042,Inc 5 Women Brown Heels,Flats,Brown,,images/13042.jpg
6889,Forever New Women Stone Cream Jacket,Jackets,Cream,,images/6889.jpg
31312,W Women Peach Kurta,Kurtas,Peach,,images/31312.jpg
12190,Basics Men Blue Slim Fit Checked Shirt,Shirts,Blue,,images/12190.jpg
55657,Catwalk Women Golden Wedges,Heels,Gold,,images/55657.jpg
19578,United Colors of Benetton Women Solid Purple Top,Tops,Purple,,images/19578.jpg
27879,Scullers For Her Women Blue Top,Tops,Blue,,images/27879.jpg
34452,Rocia Women Copper Sandals,Flats,Copper,,images/34452.jpg
6287,Classic Polo Men's Swiss Yellow T-shirt,Tshirts,Yellow,,images/6287.jpg
7355,Tantra Men's Black Sabbath Navy T-shirt,Tshirts,Navy Blue,,images/7355.jpg
46072,Lino Perros Men Black Leather Belt,Belts,Black,,images/46072.jpg
22537,Gas Men Eldorado Tan Casual  Sandals,Sandals,Tan,,images/22537.jpg
28831,Enamor Women Pack of 3 Mid-Rise Bikini Brief,Briefs,Brown,,images/28831.jpg
43500,French Connection Men White T-shirt,Tshirts,White,,images/43500.jpg
2627,Carlton London Women Wedge Silver Sandal,Flats,Silver,,images/2627.jpg
27045,Yelloe Off White Fur Zip Clutch,Clutches,Off White,,images/27045.jpg
13270,Palm Tree Kids Girls Printed White Tops,Tops,White,,images/13270.jpg
18698,Hanes Men Grey Ultimate Duo Dry Cotton Stretch Bikini Briefs,Briefs,Grey,,images/18698.jpg
55465,Revlon Super Lusterous Lipstick 304,Lipstick,Red,,images/55465.jpg
26197,Formula 1 Go Men Perfume,Perfume and Body Mist,Green,,images/26197.jpg
31120,Palm Tree Girls Pink Top,Tops,Pink,,images/31120.jpg
25712,ADIDAS Unisex Blue Cap,Caps,Blue,,images/25712.jpg
11527,United Colors of Benetton Men Olive Tshirts,Tshirts,Olive,,images/11527.jpg
14869,United Colors of Benetton Men Solid Black Wallets,Wallets,Black,,images/14869.jpg
40385,Tokyo Talkies Women Yellow Top,Tops,Yellow,,images/40385.jpg
15187,Arrow Sport Men Solid White Polo Tshirts,Tshirts,White,,images/15187.jpg
5402,Kalenji Ekiden 200 Wn Purple 2011,Sports Shoes,Purple,,images/5402.jpg
44725,Lotto Women Coral Elegant Flip Flops,Flip Flops,Orange,,images/44725.jpg
14055,Flying Machine Men Check Green Shirts,Shirts,Green,,images/14055.jpg
20260,Wrangler Men Applique Navy Blue Tshirt,Tshirts,Navy Blue,,images/20260.jpg
7731,Puma Men's Winglet II Grey Yellow White Flip Flop,Flip Flops,Grey,,images/7731.jpg
22153,Lee Cooper Men Brown Casual Sandals,Sandals,Brown,,images/22153.jpg
43958,Puma Men Olive Techno Ind Sandal,Sandals,Olive,,images/43958.jpg
28469,Urban Yoga Women Printed Pink T-shirt,Tshirts,Pink,,images/28469.jpg
50573,Chromozome Men Charcoal Trunk Trunks,Trunk,Charcoal,,images/50573.jpg
34036,Palm Tree Boys Check Blue Shirt,Shirts,Blue,,images/34036.jpg
55001,Lakme Absolute Lip Last Day Kiss Lip Colour,Lipstick,Pink,,images/55001.jpg
8779,Indigo Nation Men Club Satin Hot Stepper Navy Blue Shirt,Shirts,Navy Blue,,images/8779.jpg
3391,Murcia Women White With Stitch Bag,Handbags,White,,images/3391.jpg
43164,Fastrack Men Black Watch,Watches,Black,,images/43164.jpg
2243,ADIDAS Men Stripe Polo White Polo T-shirt,Tshirts,White,,images/2243.jpg
30496,Lovable Women Fiona Purple Bra,Bra,Purple,,images/30496.jpg
27421,Jockey Women Blue Lounge Pants,Lounge Pants,Blue,,images/27421.jpg
57756,Lotus Herbals Neem & Clove Purifying Face Wash,Face Wash and Cleanser,Green,,images/57756.jpg
33213,Sepia Women Printed Magenta Top,Tops,Magenta,,images/33213.jpg
39729,Arrow Woman Olive Top,Tops,Olive,,images/39729.jpg
25376,Levis Men Grey Innerwear T-Shirt,Innerwear Vests,Grey,,images/25376.jpg
11143,Scullers Men Price Catch Black Shirts,Shirts,Black,,images/11143.jpg
56684,Fabindia Beige & Maroon Mull Printed Saree,Sarees,Beige,,images/56684.jpg
4988,Gini and Jony Girl's Vanya White Polka Dot Kidswear,Dresses,White,,images/4988.jpg
44341,Indian Terrain Men Blue T-shirt,Tshirts,Blue,,images/44341.jpg
14431,Enroute Women Casual Black Flats,Heels,Black,,images/14431.jpg
20604,Baggit Women Umbrella Dum Brown Handbag,Handbags,Brown,,images/20604.jpg
52224,Lencia Grey Swarovski Pearl Necklace,Necklace and Chains,Silver,,images/52224.jpg
45293,CASIO SHEEN Women Red Dial Watch SX017,Watches,Red,,images/45293.jpg
36761,Maxima Men Black Watch,Watches,Black,,images/36761.jpg
33021,Mother Earth Women Printed Cream Kurta,Kurtas,Cream,,images/33021.jpg
25144,Lino Perros Women Leatherite Orange Handbag,Handbags,Orange,,images/25144.jpg
11371,United Colors Of Benetton Men Summer Black Shirts,Shirts,Black,,images/11371.jpg
41401,Wrangler Women White Smocked Top,Tops,White,,images/41401.jpg
14603,United Colors of Benetton Men Pack of 2 Grey Socks,Socks,Grey,,images/14603.jpg
37481,Esprit Women White Dial Watch,Watches,White,,images/37481.jpg
5254,Wildcraft Unisex Red Duffle Bag,Duffel Bag,Red,,images/5254.jpg
44173,Nike Fragrances Women Trendy Perfume 75ml,Perfume and Body Mist,Pink,,images/44173.jpg
25978,J.Del Pozo Halloween Kiss Sexy Women Perfume,Perfume and Body Mist,Pink,,images/25978.jpg
4386,Wrangler Cowboy Photo T-shirt,Tshirts,Grey,,images/4386.jpg
51693,Van Heusen Unisex Brown Sunglasses,Sunglasses,Brown,,images/51693.jpg
16154,Enroute Men Leather Black Formal Shoes,Formal Shoes,Black,,images/16154.jpg
22361,Reebok Men Navy Twist Sandals,Sports Sandals,Navy Blue,,images/22361.jpg
29789,Basics Men Pack of 3 T-shirt,Tshirts,Pink,,images/29789.jpg
19920,Wildcraft Unisex Black Outdoor Backpack,Backpacks,Black,,images/19920.jpg
7503,Nike Men's As Icon Blue T-shirt,Tshirts,Blue,,images/7503.jpg
46624,Rasasi Men Emotion Deo and Perfume Set,Deodorant,Grey,,images/46624.jpg
34204,Proline Men Navy Track Pants,Track Pants,Navy Blue,,images/34204.jpg
17086,Lino Perros Women Blue Zip Orange Wallet,Wallets,Orange,,images/17086.jpg
50741,Red Chief Men Black Shoes,Casual Shoes,Black,,images/50741.jpg
55233,Lakme Nine to Five Flawless Makeup Shell Foundation,Foundation and Primer,Skin,,images/55233.jpg
13426,United Colors of Benetton Men Stripes Red  Polo T-shirts,Tshirts,Red,,images/13426.jpg
43356,Reebok Women Charcoal Grey Fuel Techno Sports Shoes,Sports Shoes,Charcoal,,images/43356.jpg
28207,Ray-Ban Men Active Lifestyle Black Sunglasses,Sunglasses,Black,,images/28207.jpg
13846,John Miller Men Stripes Blue Shirts,Shirts,Blue,,images/13846.jpg
12994,ADIDAS Kids Boys Duramo Synthetic Black Sports Shoes,Sports Shoes,Black,,images/12994.jpg
46278,109F Women Red & White Striped Tunic,Tunics,Red,,images/46278.jpg
16508,Locomotive Men Washed Blue Jeans,Jeans,Blue,,images/16508.jpg
18492,Puma Men Danny Blue Slipper,Flip Flops,Blue,,images/18492.jpg
19540,United Colors of Benetton Men Solid Blue Sweater,Sweaters,Blue,,images/19540.jpg
7963,Puma Men's Large Logo Graphic White French T-shirt,Tshirts,White,,images/7963.jpg
8117,Fastrack Men New Analog Black Navy Watch,Watches,Black,,images/8117.jpg
