sku,name,category,color,price,image_url
33081,U.S. Polo Assn. Denim Co. Men Navy Blue T-Shirt,Tshirts,Navy Blue,,images/33081.jpg
40573,W Women Cream Kurta,Kurtas,Cream,,images/40573.jpg
56416,Biara Women Rose Red Bra,Bra,Rose,,images/56416.jpg
14491,Flying Machine Men Casual Black Casual Shoes,Casual Shoes,Black,,images/14491.jpg
37613,Madagascar3 Girls Purple Printed T-Shirt,Tshirts,Purple,,images/37613.jpg
45233,Casio Youth Series Men Analog-Digital Watch AW-80D-1AVDFAD60,Watches,Black,,images/45233.jpg
4114,Fila Men Obsidian Black Sandal,Sandals,Black,,images/4114.jpg
15543,Catwalk Women Casual Brown Wedges,Heels,Brown,,images/15543.jpg
40741,Converse Unisex Navy Blue Flip Flops,Flip Flops,Navy Blue,,images/40741.jpg
10031,Nike Men As Arsenal Co Navy Blue T-Shirts,Tshirts,Navy Blue,,images/10031.jpg
24204,Deni Yo Men Skinny Fit Blue Jeans,Jeans,Blue,,images/24204.jpg
56624,Olay Women Age Protect Anti-Ageing UV Lotion,Face Moisturisers,Black,,images/56624.jpg
4928,Gini and Jony Girl's Venice Green Blue Infant Kidswear,Tops,Green,,images/4928.jpg
41693,Superman Men Blue Printed Lounge Pants,Lounge Pants,Navy Blue,,images/41693.jpg
32361,Q&Q Men Black Dial Watch Q672J405Y,Watches,Black,,images/32361.jpg
42016,ADIDAS Men Silver Phaedra Shoes,Sports Shoes,Silver,,images/42016.jpg
12766,Spykar Men Stripe Navy Blue T-Shirts,Tshirts,Navy Blue,,images/12766.jpg
26553,ID Men Blue Shoes,Casual Shoes,Blue,,images/26553.jpg
27481,Jockey Essence Beige Bra 2004,Bra,Beige,,images/27481.jpg
54173,Femella Blue Necklace,Necklace and Chains,Blue,,images/54173.jpg
51401,Myntra Men Blue and Yellow Check Shirt,Shirts,Blue,,images/51401.jpg
35144,Allen Solly Woman Black Clutch,Clutches,Black,,images/35144.jpg
7791,Proline Men's Polo Solid Olive T-shirt,Tshirts,Green,,images/7791.jpg
47564,Portia Women Brown Sandals,Heels,Brown,,images/47564.jpg
34096,Doodle Boys Printed Red T-shirt,Tshirts,Red,,images/34096.jpg
6643,Nike Women's Transform III IN Black Pink Shoe,Sports Shoes,Pink,,images/6643.jpg
17214,United Colors of Benetton Women Funky Eyewear Black Sunglasses,Sunglasses,Black,,images/17214.jpg
45657,Park Avenue Men Navy Blue Boxer Briefs,Briefs,Navy Blue,,images/45657.jpg
4570,Nike Women Iza Black Shoe,Sports Shoes,Black,,images/4570.jpg
21312,Celine Dion Women Brown Frame Sunglasses,Sunglasses,Brown,,images/21312.jpg
15127,Arrow Sport Men Solid  Brown Trousers,Trousers,Brown,,images/15127.jpg
53732,Puma Women Green Supersuede Eco Casual Shoes,Casual Shoes,Green,,images/53732.jpg
44785,Lotto Men L500 FG White Sports Shoes,Sports Shoes,White,,images/44785.jpg
11587,W Women Printed White Kurtis,Kurtis,White,,images/11587.jpg
56240,SDL by Sweet Dreams Men Grey & Blue Pyjama Set,Night suits,Navy Blue,,images/56240.jpg
40325,ADIDAS Men White Sport Shoes,Sports Shoes,White,,images/40325.jpg
57392,Amante Women Pack of 3 Printed Briefs PFCN04,Briefs,White,,images/57392.jpg
10455,Flying Machine Men Mauvemist Purple Tshirts,Tshirts,Pink,,images/10455.jpg
24660,ADIDAS Originals Men Pink Casual Socks,Socks,Pink,,images/24660.jpg
54517,F Sports Men White Bratt Sports Shoes,Sports Shoes,White,,images/54517.jpg
18638,Puma Men V.11 Speed Black Tshirts,Tshirts,Black,,images/18638.jpg
28891,Enamor Women Beige Regular-Rise Brief,Briefs,Skin,,images/28891.jpg
48148,Fossil Women Red Wallet,Wallets,Red,,images/48148.jpg
2687,Inkfruit Women's Love Wood Orange T-shirt,Tshirts,Orange,,images/2687.jpg
30052,SKAGEN DENMARK Men Grey Dial Watch 668XLSLZM,Watches,Grey,,images/30052.jpg
3755,Status Quo Men's Concerts Black T-shirt,Tshirts,Black,,images/3755.jpg
31180,Gini and Jony Kids Leggings,Leggings,White,,images/31180.jpg
29943,Police Men Black Dual Dial Watch PL13076JPCL-04,Watches,Black,,images/29943.jpg
47100,Marvel Boys Red Light Spidey Shoes,Casual Shoes,Red,,images/47100.jpg
6227,Lee Men's Grey Yellowbrass T-shirt,Tshirts,Yellow,,images/6227.jpg
17670,Catwalk Women Fancy Black Heels,Heels,Black,,images/17670.jpg
22597,Nike Men Orange T-shirt,Tshirts,Orange,,images/22597.jpg
43792,Royal Diadem Gold & Pink Earrings,Earrings,Gold,,images/43792.jpg
30260,Red Tape Men Black Shoes,Formal Shoes,Black,,images/30260.jpg
54725,Shree Women Coral Coloured Printed Kurta,Kurtas,Pink,,images/54725.jpg
6829,Nike Women's Lunar Swift White Blue Shoe,Sports Shoes,White,,images/6829.jpg
12130,Aurelia Women Printed Green Kurtas,Kurtas,Green,,images/12130.jpg
26305,Proline Men Pack of 3 T-Shirts,Tshirts,Cream,,images/26305.jpg
3567,ADIDAS Men's Silver White Running Shoe,Sports Shoes,Silver,,images/3567.jpg
42640,W Women Red Dress,Kurtas,Red,,images/42640.jpg
23677,Red Tape Men Cross Band Brown Sandals,Sandals,Brown,,images/23677.jpg
17442,CASIO Unisex Black Small Dial Analogue and Digital Watch,Watches,Black,,images/17442.jpg
50385,Vishudh Women Pink Salwar and Dupatta,Salwar and Dupatta,Pink,,images/50385.jpg
47332,Baggit Women Purple Chata Hosh Wallet,Wallets,Purple,,images/47332.jpg
6015,Highlander Men Small Black Checked Shirt,Shirts,Black,,images/6015.jpg
35712,Nike Men Dual Fusion TR III Grey Sports Shoes,Sports Shoes,Grey,,images/35712.jpg
51257,Park Avenue Men Black & Brown Reversible Belt,Belts,Black,,images/51257.jpg
21120,s.Oliver Men Solid Purple Sweater,Sweaters,Purple,,images/21120.jpg
15315,ADIDAS Men Eqt Nitro Fashion Black Sports Shoes,Sports Shoes,Black,,images/15315.jpg
4742,Numero Uno Women NY Grey Blue Shoe,Casual Shoes,Grey,,images/4742.jpg
5690,Skechers Men Valence Envoy Black Shoe,Casual Shoes,Black,,images/5690.jpg
32537,Playboy Men Hollywood Perfume 100 ml,Perfume and Body Mist,Black,,images/32537.jpg
56072,Colorbar Wild Berry Lip Liner /Crayon 011,Lip Liner,Brown,,images/56072.jpg
37879,Happy Socks Unisex Black Socks,Socks,Black,,images/37879.jpg
24452,Nike Men White Court Shuttle IV Sports Shoes,Sports Shoes,White,,images/24452.jpg
4584,Wildcraft Unisex Red Backpack,Backpacks,Red,,images/4584.jpg
36351,Reid & Taylor Men Blue Tie,Ties,Blue,,images/36351.jpg
14001,Nike Men Solid Navy Blue Jerseys,Tshirts,Navy Blue,,images/14001.jpg
20234,Wrangler Women Baroque Polo Turquoise T-shirt,Tshirts,Blue,,images/20234.jpg
5456,Nike Men's Basic Woven Med Blue Short,Shorts,Navy Blue,,images/5456.jpg
37283,Tantra Women Brown Fight Peace T-shirt,Tshirts,Brown,,images/37283.jpg
44771,Globalite Men Navy Blue Skid Shoes,Casual Shoes,Grey,,images/44771.jpg
25746,Lino Perros Men Leather Black Belt,Belts,Black,,images/25746.jpg
11573,W Women Printed Green Kurtas,Kurtas,Green,,images/11573.jpg
39319,Gini and Jony Boys Beige Shorts,Shorts,Beige,,images/39319.jpg
33623,Lino Perros Women Blue Wallet,Wallets,Blue,,images/33623.jpg
57366,Amante Women Pink Lace Briefs PCFR11,Briefs,Pink,,images/57366.jpg
24694,Locomotive Men Striped White T-shirt,Tshirts,White,,images/24694.jpg
27011,Jealous 21 Women White Capris,Capris,White,,images/27011.jpg
13224,Palm Tree Kids Boys Printed Blue Sweatshirts,Sweatshirts,Blue,,images/13224.jpg
43554,Puma Women Cream Socks,Socks,Cream,,images/43554.jpg
28865,Proline Men Brown Striped Polo T-shirt,Tshirts,Brown,,images/28865.jpg
2673,Murcia Women Sleek Black Leatherette Hand Bag,Handbags,Black,,images/2673.jpg
31174,Gini and Jony Girls Red Top,Tops,Red,,images/31174.jpg
8349,Doodle Boy's I love Driving Green Kidswear,Tshirts,Green,,images/8349.jpg
55431,Revlon True Red Colorburst Lipstick 090,Lipstick,Red,,images/55431.jpg
34406,Myntra Men Black Printed T-shirt,Tshirts,Black,,images/34406.jpg
28059,Jockey ELANCE Men Pack Of 2 Briefs 1010,Briefs,Blue,,images/28059.jpg
48980,Lucera Women Silver Ring,Ring,Silver,,images/48980.jpg
17684,Catwalk Women Ballerina Grey Casual Shoe,Casual Shoes,Grey,,images/17684.jpg
31948,Nike Men Air Pegasus Blue Sports Shoes,Sports Shoes,Blue,,images/31948.jpg
51091,Satya Paul Green Saree,Free Gifts,Green,,images/51091.jpg
22563,Lino Perros Brown Women Casual Sling Bag,Handbags,Brown,,images/22563.jpg
7301,UCB Women Stripe Short Sleeve Blue White Top,Tops,Blue,,images/7301.jpg
46026,Estelle Women Gold Pendant with Chain,Pendant,Gold,,images/46026.jpg
30294,Myntra Men Global Response Off White T-shirt,Tshirts,Off White,,images/30294.jpg
27223,Doodle Kids Girl Printed Blue Dress,Dresses,Blue,,images/27223.jpg
13016,Inc 5 Women Casual Brown Wedges,Heels,Brown,,images/13016.jpg
3593,Converse Unisex Black Casual Shoes,Casual Shoes,Black,,images/3593.jpg
34634,Lotto Men Brown Fella Tres Shoes,Casual Shoes,Brown,,images/34634.jpg
7133,Urban Yoga Men Bottom Grey Yoga Pants,Track Pants,Grey,,images/7133.jpg
8947,Indigo Nation Men ID Printed Grey Trousers,Trousers,Grey,,images/8947.jpg
22751,BIBA Women Printed White Kurta,Kurtas,White,,images/22751.jpg
52426,Red Rose Women Blue Nightdress,Nightdress,Blue,,images/52426.jpg
39917,Tortoise Women Yellow Sling Bag,Handbags,Yellow,,images/39917.jpg
5664,Tantra Men's Shloka Blue T-shirt,Tshirts,Blue,,images/5664.jpg
57968,Prafful Rust Sari,Sarees,Rust,,images/57968.jpg
20006,United Colors of Benetton Women Printed Green T-shirt,Tshirts,Green,,images/20006.jpg
41031,Nautica Men Black Dial Watch,Watches,Black,,images/41031.jpg
25574,FILA Men Trempet Black & White Sports Shoes,Sports Shoes,Black,,images/25574.jpg
56086,ColorBar Star Shine Chai Lip Gloss 07,Lip Gloss,Brown,,images/56086.jpg
11741,Lee Men Stripes Navy Blue T-shirt,Tshirts,Navy Blue,,images/11741.jpg
10693,Doodle Girl Cute Purple Tops,Tops,Purple,,images/10693.jpg
57154,Elle Women Grey Melange T-shirt,Tshirts,Grey Melange,,images/57154.jpg
58920,Hakashi Men Combo pack Tie+Cufflink+Pocket square,Accessory Gift Set,Maroon,,images/58920.jpg
19148,United Colors of Benetton Men Navy Blue Polo Tshirt,Tshirts,Navy Blue,,images/19148.jpg
55267,Lakme Absolute Shine Line Olive Eye Liner,Kajal and Eyeliner,Olive,,images/55267.jpg
26795,Arrow Men Blue Shirt,Shirts,Blue,,images/26795.jpg
31722,Fabindia Women Anusuya Silver Earrings,Earrings,Silver,,images/31722.jpg
49638,Mineral Women Pink Top,Tops,Pink,,images/49638.jpg
43302,United Colors of Benetton Women Purple Dress,Dresses,Purple,,images/43302.jpg
2025,ADIDAS Mens Full Grey T-shirt,Tshirts,Grey,,images/2025.jpg
13472,United Colors of Benetton Women Solid White Dress,Dresses,White,,images/13472.jpg
7557,Nike Men's Tempo 5 Green Short,Shorts,Green,,images/7557.jpg
35382,Enroute Boys Grey Casual Shoes,Casual Shoes,Grey,,images/35382.jpg
19974,United Colors of Benetton Women Yellow T-shirt,Tshirts,Yellow,,images/19974.jpg
16100,M tv Women My Fab Eyewear Maroon Sunglasses,Sunglasses,Maroon,,images/16100.jpg
50715,Doodle Boys White Printed T-Shirt,Tshirts,White,,images/50715.jpg
6485,ADIDAS Men's Grey Strip T-shirt,Tshirts,Grey,,images/6485.jpg
34250,Proline Charcoal Grey Shorts,Shorts,Charcoal,,images/34250.jpg
44127,Boss Men In Motion Deo,Deodorant,Grey,,images/44127.jpg
14657,Probase Men Solid DK.Grey Trousers,Trousers,Grey,,images/14657.jpg
33849,Puma Men Blue Shoes,Casual Shoes,Blue,,images/33849.jpg
20462,Baggit Women Auxi Baby Purple Mobile Pouch,Mobile Pouch,Purple,,images/20462.jpg
15785,Facit Men Mid- Rise BF Black Briefs,Briefs,Black,,images/15785.jpg
52042,Just Natural Unisex Black Rain Jacket,Rain Jacket,Black,,images/52042.jpg
36507,United Colors of Benetton Women Grey Bag,Handbags,Grey,,images/36507.jpg
57530,Provogue Men Black Casual Shoes,Casual Shoes,Black,,images/57530.jpg
33075,U.S.Polo Assn. Men Blue & Orange Striped T-shirt,Tshirts,Blue,,images/33075.jpg
40587,Aurelia Women Brown Kurta,Kurtas,Brown,,images/40587.jpg
41455,Lee Cooper Men Grey Sandals,Sandals,Grey,,images/41455.jpg
25110,Lino Perros Women Olive Belts,Belts,Olive,,images/25110.jpg
44315,Indian Terrain Men Blue Trousers,Trousers,Blue,,images/44315.jpg
36735,Spykar Women Cult Multi T-shirt,Tshirts,Multi,,images/36735.jpg
21782,Fossil Men Edsel Brown Belt,Belts,Brown,,images/21782.jpg
59698,Avirate Cream Fitted Camisoles,Camisoles,Cream,,images/59698.jpg
33247,Arrow Men Grey Check Shirt,Shirts,Grey,,images/33247.jpg
57702,Lotus Herbals Almond Anti-Wrinkle Creme,Face Moisturisers,White,,images/57702.jpg
25322,Casio Edifice Men Chronograph Watch EF-550D-7AVDF(ED391),Watches,Grey,,images/25322.jpg
11117,Indigo Nation Men Solid Grey Shirts,Shirts,Grey,,images/11117.jpg
41667,Catwalk Women Black Heels,Heels,Black,,images/41667.jpg
32395,Arrow Woman Grey Shirt,Shirts,Grey,,images/32395.jpg
55055,Lakme Enrich Satins Lipstick 131,Lipstick,Purple,,images/55055.jpg
12792,Nike Men Manchester United Black Jersey,Tshirts,Black,,images/12792.jpg
27475,Jockey Women White Essence Bra 2001,Bra,White,,images/27475.jpg
13640,Carlton London Women Purple Flat Shoes,Flats,Purple,,images/13640.jpg
54187,Jockey MC Men Grey Pack of 2 Briefs 8003,Briefs,Charcoal,,images/54187.jpg
43130,David Beckham Women Signature Eau De Toilette 50 ml,Perfume and Body Mist,Purple,,images/43130.jpg
2217,ADIDAS Women Pink Socks,Socks,Pink,,images/2217.jpg
16332,Peter England Men Stripes Red Shirt,Shirts,Red,,images/16332.jpg
55869,Colorbar All Fired Up 2 Nail Lacquer 83V,Nail Polish,Red,,images/55869.jpg
46442,Timex Men Silver Dial Watch,Watches,Silver,,images/46442.jpg
47590,Portia Women Green Sandals,Heels,Green,,images/47590.jpg
34062,Gini and Jony Girls Printed Pink Dress,Dresses,Pink,,images/34062.jpg
50527,Chromozome Men Navy Blue Pack of 2 Briefs,Briefs,Navy Blue,,images/50527.jpg
59005,Brut Men Musk Deo,Deodorant,Black,,images/59005.jpg
56871,HM Women Black Sandals,Heels,Black,,images/56871.jpg
44588,Scullers Men White & Navy Blue Check Shirt,Shirts,White,,images/44588.jpg
32508,Franco Leone Men Brown Sandals,Sandals,Brown,,images/32508.jpg
59839,Valley of Flowers Women Fragrance Gift Set,Fragrance Gift Set,Maroon,,images/59839.jpg
21923,BIBA Women Printed Black Kurta,Kurtas,Black,,images/21923.jpg
36994,Lino Perros Women Brown Handbag,Handbags,Brown,,images/36994.jpg
10658,Doodle Girl Little frock White Tops,Tops,White,,images/10658.jpg
40128,Gini and Jony Girls Roseatte Orange Top,Tops,Orange,,images/40128.jpg
38032,Q&Q Women Black Watch,Watches,Black,,images/38032.jpg
9062,Mark Taylor Men Pink Striped Shirt,Shirts,Pink,,images/9062.jpg
48345,Pitaraa Golden Nugget Long Necklace,Necklace and Chains,Gold,,images/48345.jpg
18435,Vital Gear Unisex Black Messenger Bag,Messenger Bag,Black,,images/18435.jpg
6816,Timberland Men's Desert Walnut Brown Shoe,Casual Shoes,Brown,,images/6816.jpg
3558,Skechers Men's Brown Casual Lifestyle Shoe,Casual Shoes,Brown,,images/3558.jpg
23648,Disney Men Maroon Printed T-shirt,Tshirts,Maroon,,images/23648.jpg
12933,Classic Polo Men Broad Stripes Green Tshirts,Tshirts,Green,,images/12933.jpg
54528,F Sports Men White Charger Shoes,Casual Shoes,White,,images/54528.jpg
18607,New Hide Men Antique Brown Wallet,Wallets,Brown,,images/18607.jpg
9250,Mark Taylor Men Red Striped Shirt,Shirts,Red,,images/9250.jpg
48177,Fossil Women Blue Wallet,Wallets,Blue,,images/48177.jpg
8382,Doodle Girl's Raw Edges Light Blue Kidswear,Tshirts,Blue,,images/8382.jpg
50188,Paridhan Women Pink Handbag,Handbags,Pink,,images/50188.jpg
30851,Fabindia Women Printed Green Kurta,Kurtas,Green,,images/30851.jpg
28092,Jockey GOLDEDN Men Gold Edition White Innerwear Vest 4020,Innerwear Vests,White,,images/28092.jpg
49899,Q&Q Kids Girls White Dial Analog Watch,Watches,White,,images/49899.jpg
29140,Vogue Women Purple Sunglasses,Sunglasses,Purple,,images/29140.jpg
31983,ADIDAS Men Black Bag,Laptop Bag,Black,,images/31983.jpg
26934,Jealous 21 Women Black Dress,Dresses,Black,,images/26934.jpg
45668,Swiss Army Men Swiss Unlimited Rubber EDT Refillable Perfumes,Perfume and Body Mist,White,,images/45668.jpg
15118,Arrow Men Stripes Black Trousers,Trousers,Black,,images/15118.jpg
59237,Titan Men Black Dial Watch,Watches,Black,,images/59237.jpg
1801,Quechua Women 10L Pink Bag,Backpacks,Pink,,images/1801.jpg
37248,United Colors of Benetton Men Brown Shoes,Casual Shoes,Brown,,images/37248.jpg
15924,ADIDAS Unisex Ecb Black Backpack,Backpacks,Black,,images/15924.jpg
38200,Polaroid Men Sunglasses,Sunglasses,Black,,images/38200.jpg
42029,ADIDAS Women Purple Chill Sports Shoes,Sports Shoes,Purple,,images/42029.jpg
12759,Spykar Women Washed Blue Jeans,Jeans,Blue,,images/12759.jpg
35947,Flying Machine Men White Shirt,Shirts,White,,images/35947.jpg
18263,Aneri Women Nancy Yellow Kurta,Kurtas,Yellow,,images/18263.jpg
9634,Indigo Nation Men Price catch Black White Shirts,Shirts,White,,images/9634.jpg
48513,French Connection Women Black Top,Tops,Black,,images/48513.jpg
23822,Puma Men Breeze Red Flip Flops,Flip Flops,Red,,images/23822.jpg
29524,Playboy Women White Dial Watch,Watches,White,,images/29524.jpg
42815,Little Miss Intimates Women Green Brief,Briefs,Green,,images/42815.jpg
46489,Timex Men Blue Dial Watch,Watches,Blue,,images/46489.jpg
54970,Rasasi Women Body Lotion,Free Gifts,Pink,,images/54970.jpg
53369,Puma Women Black Bag,Handbags,Black,,images/53369.jpg
10832,Wrangler Men American Music Folk Green T-Shirts,Tshirts,Green,,images/10832.jpg
59653,FNF Green & Pink Evening Wear Sari,Sarees,Green,,images/59653.jpg
38664,Nike Men Liteforce Grey Shoes,Casual Shoes,Grey,,images/38664.jpg
4917,Gini and Jony Girl's Vollie Pink Kidswear,Tops,Pink,,images/4917.jpg
24835,Rockport Men Brown Cashaw Camel Suede Casual Shoes,Casual Shoes,Brown,,images/24835.jpg
33882,Citizen Men Black Dial Eco-Drive Watch,Watches,Black,,images/33882.jpg
59461,Lucera Silver Ring,Ring,Silver,,images/59461.jpg
32950,ADIDAS Neo Unisex Court Sequence Black Shoes,Casual Shoes,Black,,images/32950.jpg
52089,Myntra Women Black T-shirt,Tshirts,Black,,images/52089.jpg
4319,Tantra Kid's Unisex Free Spirit Turquoise Kidswear,Tshirts,Blue,,images/4319.jpg
38456,Baggit Women Orange Tinki Tower Sling Bag,Handbags,Orange,,images/38456.jpg
39584,Catwalk Women Black Heels,Heels,Black,,images/39584.jpg
56429,Streetwear Bombshell Eye Shadow,Eyeshadow,Brown,,images/56429.jpg
45802,Senorita Women Black Flats,Heels,Black,,images/45802.jpg
19183,United Colors of Benetton Men Check Grey Shirt,Shirts,Grey,,images/19183.jpg
9406,Puma Men Scribble Graphic Black Tshirts,Tshirts,Black,,images/9406.jpg
17825,Nike Unisex Air Deschutz Black Sandal,Sandals,Black,,images/17825.jpg
48721,Lucera Women Silver Earrings,Earrings,Silver,,images/48721.jpg
18051,Lino Perros Women Solid Black Wallet,Wallets,Black,,images/18051.jpg
3900,Disney Kids Girl Pooh Pink And White Top,Tshirts,Pink,,images/3900.jpg
17019,Rocia Women Casual Brown Sandal,Flats,Brown,,images/17019.jpg
49435,Vans Men Blue Shoes,Casual Shoes,Blue,,images/49435.jpg
8712,Fastrack Unisex Black Sunglasses,Sunglasses,Black,,images/8712.jpg
26598,Puma Men Faas 300 White Sports Shoes,Sports Shoes,White,,images/26598.jpg
19345,Reid&Taylor Men Solid Brown Wallet,Wallets,Brown,,images/19345.jpg
18297,Aneri Women Kaalki Multi Coloured Kurta,Kurtas,Multi,,images/18297.jpg
34861,Vans Men Era Grey Shoes,Casual Shoes,Grey,,images/34861.jpg
2228,ADIDAS Men Black Socks,Socks,Black,,images/2228.jpg
22138,Provouge Men Black Classic Formal Shoe,Formal Shoes,Black,,images/22138.jpg
55856,Colorbar Pro Rosie Nail Lacquer 015,Nail Polish,Red,,images/55856.jpg
6688,UCB Women's V Neck Black T-shirt,Tshirts,Black,,images/6688.jpg
54984,Femella Women Printed Blue Lounge Pants,Lounge Pants,Blue,,images/54984.jpg
50518,Chromozome Men Black Innerwear Vest,Innerwear Vests,Black,,images/50518.jpg
28402,Idee Women Brown Sunglasses,Sunglasses,Brown,,images/28402.jpg
43933,Catwalk Women Black Heels,Heels,Black,,images/43933.jpg
11914,Franco Leone Men Casual Black Sandals,Sandals,Black,,images/11914.jpg
15588,Spykar Men Striped Blue Shirt,Shirts,Blue,,images/15588.jpg
33278,Gini and Jony Boys Washed Blue Jeans,Jeans,Blue,,images/33278.jpg
5831,Puma Men's Cbn Logo Black T-Shirt,Tshirts,Black,,images/5831.jpg
11128,Urban Yoga Men Solid Beige Track Pants,Track Pants,Beige,,images/11128.jpg
39742,Arrow Men Red Shoes,Casual Shoes,Red,,images/39742.jpg
44118,Hugo Men Just Different 150 ml Perfume,Perfume and Body Mist,Black,,images/44118.jpg
58547,Miami Blues Women Sunglasses,Sunglasses,Black,,images/58547.jpg
14668,Basics Men White Slim Fit Checked Shirt,Shirts,White,,images/14668.jpg
33876,Citizen Men Black Dial Chronograph Watch,Watches,Black,,images/33876.jpg
36538,United Colors of Benetton Women Blue Wallet,Wallets,Blue,,images/36538.jpg
25913,Femella Women Blue Leggings,Leggings,Blue,,images/25913.jpg
44924,Jack & Jones Men Blue Jeans,Jeans,Blue,,images/44924.jpg
39570,Catwalk Women Black Heels,Heels,Black,,images/39570.jpg
32198,Fabindia Men Printed Grey Kurta,Kurtas,Grey,,images/32198.jpg
52841,Adrika Green Earrings,Earrings,Green,,images/52841.jpg
19177,United Colors Of Benetton Men Navy Blue Shirt,Shirts,Navy Blue,,images/19177.jpg
55258,Lakme Absolute Forever Silk Blue Cosmos Eye Liner,Kajal and Eyeliner,Blue,,images/55258.jpg
49607,Catwalk Women Brown Heeled Shoes,Heels,Brown,,images/49607.jpg
16903,Status Quo Men Solid Dark Grey Sweatshirt,Sweatshirts,Grey,,images/16903.jpg
8520,Nike Women Nike Grey handbag Grey Bags,Handbags,Grey,,images/8520.jpg
27678,Murcia Women Brown Handbag,Handbags,Brown,,images/27678.jpg
7568,Nike Men's Black Polo T-shirt,Tshirts,Black,,images/7568.jpg
2826,Lee Cooper Men Leather Semi Formal Brown Shoe,Formal Shoes,Brown,,images/2826.jpg
28630,Nike Men Pintuck Grey Track Pants,Track Pants,Grey,,images/28630.jpg
18899,Arrow Woman Igor Maroon Top,Tops,Maroon,,images/18899.jpg
52419,Red Rose Women Coffee Brown Nightdress,Nightdress,Coffee Brown,,images/52419.jpg
41832,Skechers Men Black Sneakers,Casual Shoes,Black,,images/41832.jpg
4789,ADIDAS Men's Demon Grey T-shirt,Tshirts,Grey,,images/4789.jpg
56885,HM Women Red Heels,Heels,Red,,images/56885.jpg
57957,Prafful Multi Coloured Sari,Sarees,Multi,,images/57957.jpg
20039,United Colors of Benetton Women Olive Floral Design Tights,Tights,Olive,,images/20039.jpg
58123,Rreverie Silver & White Earrings,Earrings,Silver,,images/58123.jpg
24499,Mother Earth Women Green Printed Kurta,Kurtas,Green,,images/24499.jpg
20805,Fila Men Rambler Olive Flip Flops,Flip Flops,Olive,,images/20805.jpg
9096,Converse Unisex Ct As Star Chevron Hi Blue Casual Shoes,Casual Shoes,Blue,,images/9096.jpg
43759,Royal Diadem Black Earrings,Earrings,Gold,,images/43759.jpg
7930,Proline Men Black Polo T-shirt,Tshirts,Black,,images/7930.jpg
19513,Wrangler Leather Men Brown Wallets,Wallets,Brown,,images/19513.jpg
8144,Fastrack Women Economy Analog Red Black Watch,Watches,Red,,images/8144.jpg
17489,Rockport Women Beige Flats,Flats,Off White,,images/17489.jpg
28254,Wild Stone Men Forest Spice Deo,Deodorant,Green,,images/28254.jpg
13815,Proline Pack of 3 Printed T-shirts,Tshirts,Grey,,images/13815.jpg
8978,Puma Women Saba Ballet DC3 Purple Casual Shoes,Casual Shoes,Purple,,images/8978.jpg
48183,Fossil Women Brown Handbag,Handbags,Brown,,images/48183.jpg
29988,Aspen Women Mother Of Pearl Dial Watch AP1193,Watches,White,,images/29988.jpg
51892,Nyk Women Mushroom Brown Wallet,Wallets,Mushroom Brown,,images/51892.jpg
8376,Fastrack Men Black Backpack,Backpacks,Black,,images/8376.jpg
46825,Catwalk Women Off-White and Blue Pumps,Casual Shoes,Off White,,images/46825.jpg
19721,United Colors Of Benetton Men Grey Shirt,Shirts,Grey,,images/19721.jpg
34439,Myntra Women Explorer White T-shirt,Tshirts,White,,images/34439.jpg
27812,Bulchee Men Black & Brown Reversible Belt,Belts,Black,,images/27812.jpg
28066,Jockey ELANCE Mens Grey Melange Trunks 1015,Trunk,Grey Melange,,images/28066.jpg
16769,Spice Art Women Shimmer Silver Clutch,Clutches,Silver,,images/16769.jpg
31977,Nike Women Lunarswift +3 Olive Sports Shoes,Sports Shoes,Olive,,images/31977.jpg
46019,Fabindia Women White Printed Kurta,Kurtas,White,,images/46019.jpg
58311,Jockey LCESCBRA Men Pack of 3 Socks 2004,Socks,Black,,images/58311.jpg
5469,Nike Men's Nike Streetgato Black Shoe,Sports Shoes,Black,,images/5469.jpg
25779,Arrow Men Black Suspenders,Suspenders,Black,,images/25779.jpg
39326,Gini and Jony Girls Black Leggings,Leggings,Black,,images/39326.jpg
14802,United Colors of Benetton Women Solid Maroon Handbags,Handbags,Maroon,,images/14802.jpg
57359,Amante Black Printed Full-Coverage Bra BGSW01,Bra,Black,,images/57359.jpg
5638,ADIDAS Men's Adi Liner Brown Flip Flop,Flip Flops,Brown,,images/5638.jpg
57934,Clarks Men Brown Sandals,Sandals,Brown,,images/57934.jpg
40983,Gini and Jony Boys United White T-shirt,Tshirts,White,,images/40983.jpg
58140,Rreverie Silver Earrings,Earrings,Silver,,images/58140.jpg
59092,Peri Peri Women Black Bra,Bra,Black,,images/59092.jpg
41851,Genesis Men Pack of 3 Socks,Socks,Black,,images/41851.jpg
21188,ADIDAS Men Adi Stars Tread Black Flip Flops,Flip Flops,Black,,images/21188.jpg
57108,Elle Women White Top,Tops,White,,images/57108.jpg
20866,Disney Kids-Unisex Diamond Red Sandals,Sandals,Red,,images/20866.jpg
39177,Aneri Women Purple Printed Kurta,Kurtas,Purple,,images/39177.jpg
36903,Fossil Men Brown Dial Chronograph Watch FS4673,Watches,Brown,,images/36903.jpg
25528,Wrangler Women Salena Navy Blue Check Shirt,Shirts,Navy Blue,,images/25528.jpg
7953,Puma Men's Lifestyle Polo Mood Indigo T-shirt,Tshirts,Navy Blue,,images/7953.jpg
12198,Basics Men Solid Purple Tshirts,Tshirts,Purple,,images/12198.jpg
19570,United Colors of Benetton Men Printed Blue TShirt,Tshirts,Blue,,images/19570.jpg
6881,Forever New Women Sleeveless Peach Top,Tops,Peach,,images/6881.jpg
46248,Fusion Beats Women Teal Top,Tops,Teal,,images/46248.jpg
16538,Basics Men White Slim Fit Checked Shirt,Shirts,White,,images/16538.jpg
28237,Secret Temptation Women Play Deo,Deodorant,Pink,,images/28237.jpg
31128,Gini and Jony Girls Printed Teal Dress,Dresses,Blue,,images/31128.jpg
8315,Wildcraft Men Organic Cotton Blue T-shirt,Tshirts,Blue,,images/8315.jpg
46846,Barbie Purple Girls Slippers,Sandals,Purple,,images/46846.jpg
18690,Hanes Women Pack of Three 100% Cotton Plain Bikini Briefs,Briefs,Pink,,images/18690.jpg
47994,Helix Men Black Watch,Watches,Black,,images/47994.jpg
43508,French Connection Women Navy Blue Striped Dress,Dresses,White,,images/43508.jpg
31914,Fabindia Women Braided Blue Clutch,Clutches,Blue,,images/31914.jpg
35588,Gliders Men Black Sandals,Sandals,Black,,images/35588.jpg
