sku,name,category,color,price,image_url
29744,Fossil Men Black Dial Chronograph Watch CH2783,Watches,Black,,images/29744.jpg
28696,W Women Printed Rust Kurta,Kurtas,Rust,,images/28696.jpg
2880,Catwalk Women Leather Formal Grey Heels,Heels,Grey,,images/2880.jpg
53109,Fabindia Silver Earrings,Earrings,Silver,,images/53109.jpg
5299,Reebok Unisex Red Backpack,Backpacks,Red,,images/5299.jpg
24867,Reid & Taylor Men Casual Black Belt,Belts,Black,,images/24867.jpg
59433,Spice Art Women Red Clutch,Clutches,Red,,images/59433.jpg
53935,Kiara Women Brown Handbag,Handbags,Brown,,images/53935.jpg
38404,Baggit Women Purple Xylo Taj Belt,Belts,Purple,,images/38404.jpg
44982,Maxima Women White Dial Watch,Watches,White,,images/44982.jpg
25189,Lino Perros Women Classic Beige Handbag,Handbags,Beige,,images/25189.jpg
45850,Vishudh Women Blue Kurta,Kurtas,Blue,,images/45850.jpg
59601,FNF Brown Wedding Collection Sari,Sarees,Brown,,images/59601.jpg
4179,Rockport Men's Tyson Black Shoe,Formal Shoes,Black,,images/4179.jpg
5897,Puma Women's Feuerwerk White Shoe,Casual Shoes,White,,images/5897.jpg
24269,Quiksilver Men Grey Printed T-shirt,Tshirts,Grey,,images/24269.jpg
38636,Nike Men Blue Cricket Tee T-shirt,Tshirts,Blue,,images/38636.jpg
56649,Mumbai Slang Women Cream Kurti,Kurtis,Cream,,images/56649.jpg
4945,Gini and Jony Boy's Kaniel White Yellow Kidswear,Tshirts,White,,images/4945.jpg
35915,Peperone Women Blue Handbag,Handbags,Blue,,images/35915.jpg
31589,Mark Taylor Men Printed Black T-shirt,Tshirts,Black,,images/31589.jpg
49493,Vans Men Green & Grey Era Shoes,Casual Shoes,Green,,images/49493.jpg
23870,ADIDAS Men Black  Track Pant,Track Pants,Black,,images/23870.jpg
48541,Wrangler Men Brown Belt,Belts,Brown,,images/48541.jpg
9666,Indigo Nation Men Bling Blue Shirts,Shirts,Blue,,images/9666.jpg
18231,Manchester United Men Printed Navy Blue Tshirt,Tshirts,Navy Blue,,images/18231.jpg
35129,Allen Solly Woman Red Bangle,Bangle,Red,,images/35129.jpg
42847,French Connection Women Black Purse,Clutches,Black,,images/42847.jpg
29576,Vans Men Fontana White Shoes,Casual Shoes,White,,images/29576.jpg
17279,U.S. Polo Assn. Men Printed Navy Blue Tshirt,Tshirts,Navy Blue,,images/17279.jpg
47509,Facit Men Brown Brief,Briefs,Brown,,images/47509.jpg
59265,Titan Women Mother Of Pearl Watch,Watches,White,,images/59265.jpg
1853,Inkfruit Mens Little Bit More T-shirt,Tshirts,Yellow,,images/1853.jpg
14098,Flying Machine Men Printed Blue Tshirts,Tshirts,Blue,,images/14098.jpg
15976,Turtle Solid Men Purple Shirt,Shirts,Purple,,images/15976.jpg
32768,Music Men Printed Grey T-shirt,Tshirts,Grey,,images/32768.jpg
39380,Peter England Men Blue Party Jeans,Jeans,White,,images/39380.jpg
10438,Flying Machine Men Midrise Blue Jeans,Jeans,Blue,,images/10438.jpg
48125,Fossil Women Multi Coloured Ombre Braid Belt,Belts,Multi,,images/48125.jpg
9202,Puma Men Yacht L Red Casual Shoes,Casual Shoes,Red,,images/9202.jpg
27088,Aneri Women Aaliya Black Kurta,Kurtas,Black,,images/27088.jpg
18655,Fila Men Drop Needle Black Slippers,Flip Flops,Black,,images/18655.jpg
19787,U.S. Polo Assn. Men Solid White Tshirt,Tshirts,White,,images/19787.jpg
46883,Ben 10 Boys Black & Silver Shoes,Casual Shoes,Black,,images/46883.jpg
3738,Lotto Men's Kochi Tuskers Cotton Graphic White T-shirt,Tshirts,White,,images/3738.jpg
30803,Fabindia Men Blue Shirt,Shirts,Blue,,images/30803.jpg
7398,Red Tape Men Brown Shoes,Formal Shoes,Brown,,images/7398.jpg
26966,Jealous 21 Women Check Purple Shirt,Shirts,Purple,,images/26966.jpg
51008,Enamor Purple Bra,Bra,Purple,,images/51008.jpg
29112,Puma Women Pack of 3 Socks,Socks,White,,images/29112.jpg
18467,Reebok Reegame Men Perfumes,Perfume and Body Mist,White,,images/18467.jpg
6844,Timberland Unisex Boot Lace Shoe Accessories,Shoe Accessories,Brown,,images/6844.jpg
9030,Buckaroo Men loma Brown Casual Shoes,Casual Shoes,Brown,,images/9030.jpg
7996,Fila Men's Striper Pique Polo Purple Navy T-shirt,Tshirts,Purple,,images/7996.jpg
26368,Arrow Woman Red Shirt,Shirts,Red,,images/26368.jpg
29320,ADIDAS Men Green Jersey,Tshirts,Green,,images/29320.jpg
12961,ADIDAS Men Casual Brown Sandals,Sandals,Brown,,images/12961.jpg
45408,Rocia Women Beige & Brown Sandals,Flats,Beige,,images/45408.jpg
15378,Fila Men Coloda Grey Sports Shoes,Sports Shoes,Grey,,images/15378.jpg
58185,Rocky S Women Purple Handbag,Handbags,Purple,,images/58185.jpg
40946,Gini and Jony Girls Nautical Blues Navy Blue Top,Tops,Navy Blue,,images/40946.jpg
21971,Murcia Women Casual Multi Handbag,Handbags,Green,,images/21971.jpg
33488,Doodle Kids Boy Check Purple Shirt,Shirts,Purple,,images/33488.jpg
52679,Morellato Women Silver Dial Watch,Watches,Bronze,,images/52679.jpg
59291,Titan Edge Men Grey Dial Watch,Watches,Grey,,images/59291.jpg
20259,Wrangler Men Polo White T-shirt,Tshirts,White,,images/20259.jpg
39374,Helix Women Green Dial Watch,Watches,Green,,images/39374.jpg
15982,Turtle Stripes Men Grey Shirt,Shirts,Grey,,images/15982.jpg
14850,United Colors of Benetton Men Solid Black Wallets,Wallets,Black,,images/14850.jpg
28808,Denizen Men Striped Black Shirt,Shirts,Black,,images/28808.jpg
43539,French Connection Women Multicoloured Striped Top,Tops,White,,images/43539.jpg
13249,Palm Tree Kids Boy Solid Brown Trousers,Trousers,Brown,,images/13249.jpg
19773,United Colors of Benetton Women Grey Striped Tights,Stockings,Grey,,images/19773.jpg
46877,Lino Perros Men Pack of 2 Socks,Socks,Beige,,images/46877.jpg
31119,Gini and Jony Girls Purple Top,Tops,Purple,,images/31119.jpg
8324,Doodle Boy's Athletic 77 Dept White Kidswear,Tshirts,White,,images/8324.jpg
28034,Jockey ELANCE Men Charcoal Grey Y Front Briefs 1006,Briefs,Charcoal,,images/28034.jpg
47199,Franco Leone Men Dark Brown Formal Shoes,Formal Shoes,Brown,,images/47199.jpg
27840,Bulchee Men Red Leather Belt,Belts,Red,,images/27840.jpg
26992,Jealous 21 Women Washed Light Blue Jeans,Jeans,Blue,,images/26992.jpg
31925,Fabindia Women Red Silk Handbag,Handbags,Red,,images/31925.jpg
18493,Puma Men Duncan Multi Slipper,Sandals,Multi,,images/18493.jpg
8116,Fastrack Men Analog Steel Navy Blue Watch,Watches,Navy Blue,,images/8116.jpg
7962,Puma Men's Graphic Black Red T-shirt,Tshirts,Black,,images/7962.jpg
19541,United Colors of Benetton Men Solid Black Gloves,Gloves,Black,,images/19541.jpg
13847,United Colors of Benetton Women Printed White Top,Tops,White,,images/13847.jpg
16509,Locomotive Men Washed Blue Jeans,Jeans,Blue,,images/16509.jpg
12995,Timberland Kids Boys Brown Casual Shoes,Casual Shoes,Brown,,images/12995.jpg
46279,109F Women Blue & Green Polka Dot Print Tunic,Tunics,Blue,,images/46279.jpg
53599,Q&Q Men Black Digital Watch,Free Gifts,Black,,images/53599.jpg
58171,Rocky S Women Grey Handbag,Handbags,Grey,,images/58171.jpg
5609,ADIDAS Men Receptor Navy Sports Sandals,Sports Sandals,Navy Blue,,images/5609.jpg
21985,Murcia Women Casual Brown Handbag,Handbags,Brown,,images/21985.jpg
39146,Aneri Women Purple Ombre Churidar Kurta & Dupatta Set,Kurta Sets,Purple,,images/39146.jpg
57139,Elle Women Black Etra Slim Fit Trousers,Trousers,Black,,images/57139.jpg
16951,Image Men Classic Eyewear Black Sunglasses,Sunglasses,Black,,images/16951.jpg
49655,Mineral Pink & Green Skirt,Skirts,Pink,,images/49655.jpg
19125,Lotto Women XL Kelly Blue Slippers,Flip Flops,Blue,,images/19125.jpg
48787,Lucera Women Silver Pendant,Pendant,Silver,,images/48787.jpg
17883,Levis Men Comfort Style Navy Blue Innerwear Vest,Innerwear Vests,Navy Blue,,images/17883.jpg
2048,ADIDAS Men's Crew Black T-shirt,Tshirts,Black,,images/2048.jpg
22358,John Players Men Solid Beige Shirt,Shirts,Beige,,images/22358.jpg
28662,Nike Men Lunar Flow Black Casual Shoes,Casual Shoes,Black,,images/28662.jpg
50778,Clarks Men Navy Leather Sneakers,Casual Shoes,Navy Blue,,images/50778.jpg
2874,Catwalk Women Black Heels,Heels,Black,,images/2874.jpg
33824,Puma Women Grey Axis Sports Shoes,Sports Shoes,Grey,,images/33824.jpg
58515,Tonga Women White Top,Tops,White,,images/58515.jpg
25941,Femella Women Yellow & Brown Scarf,Scarves,Yellow,,images/25941.jpg
45098,Bwitch Fushia Pink Sapphire Brief,Briefs,Pink,,images/45098.jpg
33018,Mother Earth Women Striped Green Kurta,Kurtas,Green,,images/33018.jpg
44976,Maxima Attivo Men Black Dial Watch,Watches,Black,,images/44976.jpg
11348,Lee Men Navy Blue Powell Fit Jeans,Jeans,Navy Blue,,images/11348.jpg
41438,Lee Cooper Men White Sports Shoes,Sports Shoes,White,,images/41438.jpg
52813,JAG Men Chocolate Brown Leather Wallet,Wallets,Brown,,images/52813.jpg
39522,Peter England Unisex Black Bag,Laptop Bag,Black,,images/39522.jpg
44378,ADIDAS Men Dynamic Pulse Perfume,Perfume and Body Mist,Black,,images/44378.jpg
58727,Puma Women Purple T-shirt,Tshirts,Purple,,images/58727.jpg
14408,Enroute Women Casual Beige Flats,Heels,Beige,,images/14408.jpg
11946,Ganuchi Men Casual Brown Sandals,Sandals,Brown,,images/11946.jpg
36758,Maxima Women Grey Dial Watch,Watches,Grey,,images/36758.jpg
5863,ADIDAS Men's Saltero Purple T-shirt,Tshirts,Purple,,images/5863.jpg
39710,ADIDAS Original Unisex Blue Dial Chronograph Watch ADH2639,Watches,Blue,,images/39710.jpg
19317,Nike Unisex Casual Black Backpack,Backpacks,Black,,images/19317.jpg
55038,Lakme Absolute Matte Brick Lipstick 51,Lipstick,Brown,,images/55038.jpg
8740,Indigo Nation Men Checks Navy Blue Shirt,Shirts,Navy Blue,,images/8740.jpg
23884,Fila Men Hitech White Sports Shoes,Sports Shoes,White,,images/23884.jpg
9692,Classic Polo Men Ikon Navy Blue Polo Tshirts,Tshirts,Navy Blue,,images/9692.jpg
27418,Jockey Women Red Relaxed Capris,Capris,Red,,images/27418.jpg
34833,ADIDAS Women Sweep Green Sandals,Flats,Green,,images/34833.jpg
7708,Jealous 21 Women Aliah Blue Jegging,Jeans,Blue,,images/7708.jpg
55804,SDL by Sweet Dreams Women Multicoloured Striped Night Suit S11-3129,Night suits,Multi,,images/55804.jpg
51498,Denizen Women Blue Jeans,Jeans,Blue,,images/51498.jpg
29582,Puma Women Black Grace Flats,Flats,Black,,images/29582.jpg
28450,Urban Yoga Women Grey Track Pants,Track Pants,Grey,,images/28450.jpg
4710,ADIDAS Unisex New York Chronographic Digital Black Red Watch,Watches,Black,,images/4710.jpg
15347,Nike Men Special Edition 3 Star Cricket Fan Black Tshirts,Tshirts,Black,,images/15347.jpg
52480,Red Rose Blue & Black Nightdress,Baby Dolls,Blue,,images/52480.jpg
59068,Peri Peri Women Blue Bra,Bra,Blue,,images/59068.jpg
21172,s.Oliver Women Powder Blue Tunic,Tunics,Blue,,images/21172.jpg
40979,Gini and Jony Boys Core Yellow T-shirt,Tshirts,Yellow,,images/40979.jpg
38863,Latin Quarters Women Blue Printed Top,Tops,Blue,,images/38863.jpg
14295,Classic Polo Men Printed pack of 3 Tshirts,Tshirts,Black,,images/14295.jpg
56020,Colorbar Soft Touch Felin Lipstick 036,Lipstick,Purple,,images/56020.jpg
32565,ONLY Women Smock Blue Top,Tops,Blue,,images/32565.jpg
40145,Gini and Jony Girls Kinky Pink Capris,Capris,Pink,,images/40145.jpg
58986,Cavallini Women Deo,Deodorant,Magenta,,images/58986.jpg
24400,Vishudh Women Black Printed Kurta,Kurtas,Black,,images/24400.jpg
10635,Carlton London Men Semi oxfords Black Casual Shoes,Casual Shoes,Black,,images/10635.jpg
18458,David Beckham Instinct Men Deos,Deodorant,White,,images/18458.jpg
27285,Mother Earth Women Brown Kurta,Kurtas,Brown,,images/27285.jpg
48328,Pitaraa Women Pink Sling Bag,Handbags,Pink,,images/48328.jpg
42612,Estelle Women Gold Earring & Pendant Set,Jewellery Set,Gold,,images/42612.jpg
3535,Myntra Men's Saadhu Starter Kit Navy Blue T-shirt,Tshirts,Navy Blue,,images/3535.jpg
26357,Arrow Woman Striped Pink T-shirt,Tshirts,Pink,,images/26357.jpg
12162,Aurelia Women Solid Blue Leggings,Leggings,Green,,images/12162.jpg
47360,Baggit Women Green Bag,Handbags,Green,,images/47360.jpg
9833,Little Miss Women Printed Olive Green T-shirt,Tshirts,Green,,images/9833.jpg
17410,Lotto Men Atlantica White Sports Shoe,Sports Shoes,White,,images/17410.jpg
23625,Doodle Kids Girls Pink Retro Top,Tops,Pink,,images/23625.jpg
51205,Enamor Women Skin Bra,Bra,Skin,,images/51205.jpg
7195,Jealous 21 Women Knit Butterfly Print White Top,Tops,White,,images/7195.jpg
30000,Aspen Women Silver Dial Watch,Watches,Silver,,images/30000.jpg
13282,Gini and Jony Kids Solid Black Capris,Capris,Black,,images/13282.jpg
54545,Lino Perros Women Orange Handbag,Handbags,Orange,,images/54545.jpg
55497,Revlon Peony Pivoine Lip Gloss 008,Lip Gloss,Pink,,images/55497.jpg
12350,Reid & Taylor Men Pink Striped Shirt,Shirts,Pink,,images/12350.jpg
29911,Police Men Black Dial Watch PL12176JS02A,Watches,Black,,images/29911.jpg
3707,Classic Polo Men's Purple Black & Cream Stripe T-shirt,Tshirts,Purple,,images/3707.jpg
6275,UCB Women's Crystal Benetton Pink T-shirt,Tshirts,Pink,,images/6275.jpg
26959,Jealous 21 Women Pink Shirt,Shirts,Pink,,images/26959.jpg
46080,ADIDAS Men Blue Sports Shoes,Sports Shoes,Blue,,images/46080.jpg
51037,Enamor Women White and Pink Briefs,Briefs,White,,images/51037.jpg
21340,Pal Zileri Men Casual Copper Frame Sunglasses,Sunglasses,Copper,,images/21340.jpg
4522,Puma Men's Faas Grey Shoes,Sports Shoes,Grey,,images/4522.jpg
45605,Arrow Men Black Formal Shoes,Formal Shoes,Black,,images/45605.jpg
37225,United Colors of Benetton Men Olive Duffle Bag,Duffel Bag,Olive,,images/37225.jpg
53760,Puma Men Navy Blue and White T-shirt,Tshirts,Navy Blue,,images/53760.jpg
15949,Turtle Men Check Black Ties,Ties,Black,,images/15949.jpg
32757,Fila Men Glam II Multi Coloured Shoes,Casual Shoes,Multi,,images/32757.jpg
56212,Estelle Women Gold Pendant with Chain,Pendant,Gold,,images/56212.jpg
24632,ADIDAS Unisex Red Checks Flip Flops,Flip Flops,Red,,images/24632.jpg
10407,United Colors of Benetton Men Solid Grey Shirts,Shirts,Grey,,images/10407.jpg
33685,Cobblerz Men Black Formal Shoes,Formal Shoes,Black,,images/33685.jpg
12734,Nike Women Samba Black Handbags,Handbags,Black,,images/12734.jpg
42044,Nike Men Wardour Chukka White Casual Shoes,Casual Shoes,Grey,,images/42044.jpg
3363,Myntra Women Creative designs Black T-shirt,Tshirts,Black,,images/3363.jpg
9659,Indigo Nation Men Reversible Bling Blue Shirts,Shirts,Blue,,images/9659.jpg
30464,Lovable Women All Day Long White Bra,Bra,White,,images/30464.jpg
43196,Fastrack Women White Dial Watch,Watches,White,,images/43196.jpg
54121,Rocia Women Black Flats,Heels,Black,,images/54121.jpg
35116,Allen Solly Woman Black Necklace,Necklace and Chains,Black,,images/35116.jpg
42878,,Clutches,Maroon,,images/42878.jpg
16394,Levis Men Check Blue  Shirts,Shirts,Blue,,images/16394.jpg
51453,Tonga Women Multicoloured Top,Tops,Multi,,images/51453.jpg
50581,Chromozome Men Grey Pack of 2 Briefs,Briefs,Grey Melange,,images/50581.jpg
17246,U.S. Polo Assn. Men Stripes Navy Blue Polo Tshirt,Tshirts,Navy Blue,,images/17246.jpg
23073,Arrow Men Grey Trousers,Trousers,Grey,,images/23073.jpg
6611,Spykar Men Stripes Navy Blue Shirt,Shirts,Navy Blue,,images/6611.jpg
47536,Portia Women Black Flats,Flats,Black,,images/47536.jpg
5094,Wrangler Men's Reverse Print Brown T-shirt,Tshirts,Brown,,images/5094.jpg
15511,Rockport Women Jeanie Thong Chain Pink Flats,Heels,Pink,,images/15511.jpg
21724,Catwalk Women Casual Brown Heels,Heels,Brown,,images/21724.jpg
36793,Maxima Attivo Men Off-White Dial Watch 24130LMGT,Watches,Off White,,images/36793.jpg
4146,Nike Women Trainer White Purple Shoe,Sports Shoes,White,,images/4146.jpg
45261,Casio G-SHOCK Men Black Dial Analogue & Digital Watch G220,Watches,Red,,images/45261.jpg
24256,Numero Uno Men Green Casual Shoes,Casual Shoes,Green,,images/24256.jpg
10063,Puma Men spine tee Yellow Tshirts,Tshirts,Yellow,,images/10063.jpg
38609,Nike Men Printed Blue T-shirt,Tshirts,Blue,,images/38609.jpg
32333,Q&Q Men Black Dial Watch,Watches,Black,,images/32333.jpg
56676,Maxima Men White Chronograph Watch,Watches,White,,images/56676.jpg
25384,Levis Men Blue Brief,Briefs,Blue,,images/25384.jpg
53136,Catwalk Women Black Heels,Heels,Black,,images/53136.jpg
44181,Nike Fragrances Women Free Soul Perfume 150 ml,Perfume and Body Mist,White,,images/44181.jpg
24858,Mark Taylor Men White Striped Shirt,Shirts,White,,images/24858.jpg
37473,Esprit Men Black Watch,Watches,Black,,images/37473.jpg
4374,Batman Men's Batman Big Face Black T-shirt,Tshirts,Black,,images/4374.jpg
15723,Nike Women Ballista II White Sports Shoes,Sports Shoes,White,,images/15723.jpg
40521,Titan Men Cream Dial Watch,Watches,Cream,,images/40521.jpg
57596,Lotus Herbals Moistpetals Rose Lipstick 141,Lipstick,Rose,,images/57596.jpg
56444,Streetwear Shine Divine Cherry Divine Nail Enamel 16,Nail Polish,Red,,images/56444.jpg
11383,United Colors Of Benetton Women Light Winter Black Tops,Tops,Black,,images/11383.jpg
42276,Vans Men Navy Blue Michoacan Shoes,Casual Shoes,Navy Blue,,images/42276.jpg
3151,Nike Men's Lunarswift Blue Shoe,Sports Shoes,Blue,,images/3151.jpg
31784,Lee Women Katie Red Top,Tops,Red,,images/31784.jpg
26733,Reebok Men Chennai Super Kings Deo,Deodorant,Gold,,images/26733.jpg
12506,Red Tape Men Brown Shoes,Casual Shoes,Brown,,images/12506.jpg
17848,Flying Machine Women Mind Your White Tshirt,Tshirts,White,,images/17848.jpg
22393,ADIDAS Women Verve Tee Grey T-shirt,Tshirts,Grey,,images/22393.jpg
51661,Fossil Men Black Dial Watch AM4368,Watches,Black,,images/51661.jpg
35324,Fabindia Women Anusuya Silver Earrings,Earrings,Silver,,images/35324.jpg
18800,Peter England Unisex Casual Navy Blue Backpack,Backpacks,Navy Blue,,images/18800.jpg
6423,Lotto Men's Bavarian Black Yellow Flip Flop,Flip Flops,Black,,images/6423.jpg
17074,Lino Perros Women Brown Belt,Belts,Brown,,images/17074.jpg
23241,Aneri Women Juhi Blue Kurti,Kurtis,Blue,,images/23241.jpg
19328,Myntra Men Maroon Sweatshirt,Sweatshirts,Maroon,,images/19328.jpg
55007,Lakme Sheer Satin Lip Gloss 11,Lip Gloss,Pink,,images/55007.jpg
22969,U.S. Polo Assn. Black Unisex Lug-Laptop Backpack,Backpacks,Black,,images/22969.jpg
3397,Murcia Women Green Handbag,Handbags,Green,,images/3397.jpg
2245,ADIDAS Women White Polo T-shirt,Tshirts,White,,images/2245.jpg
43162,Fastrack Women Silver Dial Watch,Watches,Silver,,images/43162.jpg
27427,Jockey Women Purple Lounge Shorts 1308,Lounge Shorts,Purple,,images/27427.jpg
46410,ADIDAS Men Purple Printed T-shirt,Tshirts,Purple,,images/46410.jpg
7737,Puma Unisex Stripe Cat Black Cap,Caps,Black,,images/7737.jpg
16360,Peter England Men Stripes Purple Shirt,Shirts,Purple,,images/16360.jpg
50575,Chromozome Men Grey Trunks,Trunk,Grey Melange,,images/50575.jpg
34030,Gini and Jony Boys Check Blue Shirt,Shirts,Blue,,images/34030.jpg
20602,Baggit Women Red Selection Lisa Sling Bag,Handbags,Red,,images/20602.jpg
58718,ALayna Women Green Kurta,Kurtas,Green,,images/58718.jpg
14437,Enroute Women Silver Wedges,Heels,Silver,,images/14437.jpg
52222,Lencia Black and Silver Pendant,Pendant,Black,,images/52222.jpg
11979,Fila Men Glam Black Casual Shoes,Casual Shoes,Black,,images/11979.jpg
36767,Maxima Men Green Dial Watch,Watches,Green,,images/36767.jpg
45295,CASIO SHEEN Women Silver-Toned Dial Watch SX042,Watches,Silver,,images/45295.jpg
57750,Lotus Herbals Natural Blend Comfort Liquid Sand Foundation 310,Foundation and Primer,Skin,,images/57750.jpg
10097,Reebok Men Reeflex Run White Sports Shoes,Sports Shoes,White,,images/10097.jpg
33215,Sepia Women Off White Top,Tops,Off White,,images/33215.jpg
11145,Indigo Nation Men Bling Purple Shirts,Shirts,Purple,,images/11145.jpg
56682,Maxima Men White Chronograph Watch,Watches,White,,images/56682.jpg
25370,Levis Men Black Innerwear Vest,Innerwear Vests,Black,,images/25370.jpg
14605,United Colors of Benetton Men Stripes Blue Socks,Socks,Blue,,images/14605.jpg
44175,Nike Fragrances Women Paradise Perfume and Deo Set,Fragrance Gift Set,White,,images/44175.jpg
5252,Wildcraft Unisex Corporate Red Backpack,Backpacks,Red,,images/5252.jpg
4380,Superman Men's Dont Art Me Dark Red T-shirt,Tshirts,Red,,images/4380.jpg
33027,Mother Earth Women Printed Blue Kurta,Kurtas,Blue,,images/33027.jpg
44949,Kama Sutra Men Travel Mate Pack of 3 Deos,Deodorant,Black,,images/44949.jpg
24090,Manchester United Men Red Sweatshirt,Sweatshirts,Red,,images/24090.jpg
57562,Lotus Herbals Pure Colors  Moisturising Pink Blush Lipstick 614,Lipstick,Pink,,images/57562.jpg
11377,United Colors of Benetton Men Summer Pink Shirts,Shirts,Pink,,images/11377.jpg
25142,Lino Perros Women Red Clutch,Clutches,Red,,images/25142.jpg
41407,Wrangler Women Cowgirl Blue Top,Tops,Blue,,images/41407.jpg
55235,Lakme 9 to 5 Flawless Makeup Pearl Foundation 30 ml,Foundation and Primer,Peach,,images/55235.jpg
13420,United Colors of Benetton Men Solid Purple  polo T-shirts,Tshirts,Purple,,images/13420.jpg
43350,Reebok Men Black Fuel Extreme Sports Shoes,Sports Shoes,Black,,images/43350.jpg
22367,Ed Hardy Men Vintage  Brick Red T-Shirt,Tshirts,Red,,images/22367.jpg
51695,Van Heusen Women Oversized Sunglasses VH215-C3,Sunglasses,Purple,,images/51695.jpg
16152,Enroute Men Leather Brown Formal Shoes,Formal Shoes,Brown,,images/16152.jpg
46622,Catwalk Women Multi colour Wedges,Heels,Multi,,images/46622.jpg
7505,Nike Men's As Go Dunk T-Shirts,Tshirts,White,,images/7505.jpg
19926,Reid & Taylor Men Formal Black Tie+Cufflink+Pocket square - Combo Pack,Accessory Gift Set,Black,,images/19926.jpg
34202,Proline Men Black Track Pants,Track Pants,Black,,images/34202.jpg
17080,Lino Perros Women Flower Turquoise Blue Wallet,Wallets,Blue,,images/17080.jpg
50747,Red Chief Men Mushroom Brown Shoes,Casual Shoes,Mushroom Brown,,images/50747.jpg
36131,Nike Men Dunk High Maroon Shoes,Casual Shoes,Maroon,,images/36131.jpg
39945,GAS Men Brown Namib Shoes,Casual Shoes,Brown,,images/39945.jpg
52474,Red Rose Women White & Blue Polka Dot Print Bath Robe,Bath Robe,Blue,,images/52474.jpg
21186,ADIDAS Men Star Story Blue Flip Flops,Flip Flops,Blue,,images/21186.jpg
20054,United Colors Of Benetton Women Black Muffler,Mufflers,Black,,images/20054.jpg
44511,Coolers Men Black Sandals,Sandals,Black,,images/44511.jpg
11713,Lee Women Check Green Tunics,Tunics,Green,,images/11713.jpg
25526,Wrangler Women Poppins Red Top,Tops,Red,,images/25526.jpg
32591,ONLY Women Pink Skirt,Skirts,Pink,,images/32591.jpg
39179,Aneri Women Blue Kurtas,Kurtas,Blue,,images/39179.jpg
20868,Fila Men Stradd White Casual Shoes,Casual Shoes,White,,images/20868.jpg
58972,Colour Me Women Red Perfume,Perfume and Body Mist,Red,,images/58972.jpg
33443,Baggit Women Brown Handbag,Handbags,Brown,,images/33443.jpg
57106,Elle Women White Top,Tops,White,,images/57106.jpg
13044,Inc 5 Women Casual Black Wedges,Heels,Black,,images/13044.jpg
27271,Mother Earth Women Printed Red Tunic,Tunics,Red,,images/27271.jpg
43734,Royal Diadem Set of 4 Golden Bangles,Bangle,Gold,,images/43734.jpg
31314,W Women Red & Blue Printed Kurta,Kurtas,Red,,images/31314.jpg
8129,Fastrack Men Grey Brass Buckles Brown Belts,Belts,Brown,,images/8129.jpg
12196,Basics Men White Polo T-shirt,Tshirts,White,,images/12196.jpg
55651,Catwalk Women Blue Flats,Heels,Blue,,images/55651.jpg
13878,Scullers Men Check Red Shirts,Shirts,Red,,images/13878.jpg
47394,Baggit Women Olive Handbag,Handbags,Olive,,images/47394.jpg
50323,Aurelia Women Red Kurta,Kurtas,Red,,images/50323.jpg
28239,Park Avenue Men Tranquil Deo,Deodorant,Green,,images/28239.jpg
22703,Nike Men Capri II Mid Grey Casual Shoes,Casual Shoes,Grey,,images/22703.jpg
16536,Probase Women Checked Orange & Red Cap,Caps,Red,,images/16536.jpg
8915,Timberland Unisex Black Boot Sauce Cream,Shoe Accessories,Black,,images/8915.jpg
46246,Fusion Beats Women Green Printed Tunic,Tunics,Green,,images/46246.jpg
2621,Nike Men's Bleed blue India Colors T-shirt,Tshirts,Blue,,images/2621.jpg
43506,French Connection Men Blue T-shirt,Tshirts,Blue,,images/43506.jpg
55463,Revlon Super Lusterous Perfectly Plum Lipstick 325,Lipstick,Maroon,,images/55463.jpg
31126,Gini and Jony Girls White Dress,Dresses,White,,images/31126.jpg
34454,Rocia Women Brown Sandals,Flats,Brown,,images/34454.jpg
46074,Lino Perros Men Brown Leather Belt,Belts,Brown,,images/46074.jpg
7353,Tantra Men's Moustaches Grey T-shirt,Tshirts,Grey,,images/7353.jpg
35586,Gliders Men Brown Sandals,Sandals,Brown,,images/35586.jpg
16704,Fila Men High Density Navy Blue Tshirt,Tshirts,Navy Blue,,images/16704.jpg
36303,Angry Birds Men Black Stop The Madness T-shirt,Tshirts,Black,,images/36303.jpg
44723,Lotto Women White & Pink Blossom Flip Flops,Flip Flops,White,,images/44723.jpg
5404,Kalenji Kiprun 1000 Whi/ Blue 2011,Sports Shoes,White,,images/5404.jpg
20266,Catwalk Women Casual White Heels,Heels,White,,images/20266.jpg
14053,Flying Machine Men Check  Blue Shirts,Shirts,Blue,,images/14053.jpg
53794,Puma Men Red Ferrari T-shirt,Tshirts,Red,,images/53794.jpg
41251,Arrow Men Black & Brown Reversible Belt,Belts,Black,,images/41251.jpg
11521,United Colors of Benetton Men Blue T-shirt,Tshirts,Blue,,images/11521.jpg
25714,ADIDAS Unisex NBA Black Cap,Caps,Black,,images/25714.jpg
57334,Amante Bra BCSO01,Bra,Grey,,images/57334.jpg
40383,Tokyo Talkies Women Pink Top,Tops,Pink,,images/40383.jpg
38299,Reid & Taylor Men Brown Wallet,Wallets,Brown,,images/38299.jpg
58720,Puma Men White T-shirt,Tshirts,White,,images/58720.jpg
11941,Ganuchi Men Casual Tan Sandals,Sandals,Tan,,images/11941.jpg
5864,Converse Chuck Taylor All Star Unisex Navy Blue & Red Shoe,Casual Shoes,Navy Blue,,images/5864.jpg
57768,Lotus Herbals Tea Tree Clarifying Face Pack,Mask and Peel,White,,images/57768.jpg
25348,Levis Men Green Brief,Briefs,Green,,images/25348.jpg
39717,Arrow Woman Red Top,Tops,Red,,images/39717.jpg
49460,Vans Unisex Wine Authentic Shoes,Casual Shoes,Purple,,images/49460.jpg
42088,ADIDAS Men Brown Zapotec Shoes,Sports Shoes,Brown,,images/42088.jpg
19310,Nike Men Lunarglide+ 3 White Sports Shoe,Sports Shoes,White,,images/19310.jpg
34834,ADIDAS Women Ranger Navy Blue Sports Shoes,Sports Shoes,Navy Blue,,images/34834.jpg
9695,Classic Polo Men Vulcan White Polo Tshirts,Tshirts,White,,images/9695.jpg
16358,Peter England Men Stripes White Shirt,Shirts,White,,images/16358.jpg
46428,Timex Men Black Dial Watch,Watches,Black,,images/46428.jpg
55803,SDL by Sweet Dreams Women Purple Printed Night Suit S11-3127,Night suits,Purple,,images/55803.jpg
34008,Gini and Jony Girls Pink Top,Tops,Pink,,images/34008.jpg
